category,description,estimatedTime,imageName,ingredients,procedure,subcategory,title,times,isFavorite
regional,"Enjoy this Chunky Vegetable Hummus recipe with chopped cucumbers, red onions and plum tomatoes, and a sprinkle of crumbled feta cheese.",10.0,Chunky Vegetable Hummus Spread.jpg,"1 container (7 oz.) ATHENOS Original Hummus, 1/2 cup chopped seeded cucumber s, 1/4 cup finely chopped red onion s, 1 plum tomato, chopped, 1/4 cup ATHENOS Traditional Crumbled Feta Cheese, 3 whole wheat pita bread s (7 inch), torn into 8 pieces each","1 container (7 oz.) ATHENOS Original Hummus, 1/2 cup chopped seeded cucumber s, 1/4 cup finely chopped red onion s, 1 plum tomato, chopped, 1/4 cup ATHENOS Traditional Crumbled Feta Cheese, 3 whole wheat pita bread s (7 inch), torn into 8 pieces each",European Recipes,Chunky Vegetable Hummus Spread,"1 container (7 oz.) ATHENOS Original Hummus, 1/2 cup chopped seeded cucumber s, 1/4 cup finely chopped red onion s, 1 plum tomato, chopped, 1/4 cup ATHENOS Traditional Crumbled Feta Cheese, 3 whole wheat pita bread s (7 inch), torn into 8 pieces each",True
regional,"Try our Shrimp Fideo Recipe for an exciting new experience. Our Shrimp Fideo Recipe gets its unique flavor from garlic, cumin and Spanish paprika.",25.0,Shrimp Fideo Recipe.jpg,"1/2 cup KRAFT Real Mayo Mayonnaise, 1/2 cup KRAFT Zesty Italian Dressing, divided, 4 cloves garlic, finely chopped, 1/2 tsp. ground cumin, 1 lb. spaghetti, cooked (about 6 cups cooked), 2 large green pepper s, seeded, chopped, 1 medium onion, chopped (about 1 cup), 1-1/2 lb. large shrimp (12 to 18 count), cleaned, 1 can (15 oz.) diced tomatoes, drained, 1 Tbsp. sweet Spanish paprika (pimenton)","1/2 cup KRAFT Real Mayo Mayonnaise, 1/2 cup KRAFT Zesty Italian Dressing, divided, 4 cloves garlic, finely chopped, 1/2 tsp. ground cumin, 1 lb. spaghetti, cooked (about 6 cups cooked), 2 large green pepper s, seeded, chopped, 1 medium onion, chopped (about 1 cup), 1-1/2 lb. large shrimp (12 to 18 count), cleaned, 1 can (15 oz.) diced tomatoes, drained, 1 Tbsp. sweet Spanish paprika (pimenton)",European Recipes,Shrimp Fideo Recipe,"1/2 cup KRAFT Real Mayo Mayonnaise, 1/2 cup KRAFT Zesty Italian Dressing, divided, 4 cloves garlic, finely chopped, 1/2 tsp. ground cumin, 1 lb. spaghetti, cooked (about 6 cups cooked), 2 large green pepper s, seeded, chopped, 1 medium onion, chopped (about 1 cup), 1-1/2 lb. large shrimp (12 to 18 count), cleaned, 1 can (15 oz.) diced tomatoes, drained, 1 Tbsp. sweet Spanish paprika (pimenton)",True
regional,It's tiramisu. And it's an easy-to-make pie. This delectable dessert sports layers of creamy pudding and delicate vanilla wafers all drizzled with coffee.,195.0,Easy Tiramisu Pie.jpg,"48 vanilla wafers, divided, 1/4 cup brewed strong MAXWELL HOUSE Coffee, cooled, divided, 4 oz. (1/2 of 8-oz. pkg.) PHILADELPHIA Cream Cheese, softened, 1-1/2 cups cold milk, 1 pkg. (3.4 oz.) JELL-O Vanilla Flavor Instant Pudding, 1 tub (8 oz.) COOL WHIP Whipped Topping, thawed, ""1 oz. BAKERS Semi-Sweet Chocolate, grated""","48 vanilla wafers, divided, 1/4 cup brewed strong MAXWELL HOUSE Coffee, cooled, divided, 4 oz. (1/2 of 8-oz. pkg.) PHILADELPHIA Cream Cheese, softened, 1-1/2 cups cold milk, 1 pkg. (3.4 oz.) JELL-O Vanilla Flavor Instant Pudding, 1 tub (8 oz.) COOL WHIP Whipped Topping, thawed, ""1 oz. BAKERS Semi-Sweet Chocolate, grated""",European Recipes,Easy Tiramisu Pie,"48 vanilla wafers, divided, 1/4 cup brewed strong MAXWELL HOUSE Coffee, cooled, divided, 4 oz. (1/2 of 8-oz. pkg.) PHILADELPHIA Cream Cheese, softened, 1-1/2 cups cold milk, 1 pkg. (3.4 oz.) JELL-O Vanilla Flavor Instant Pudding, 1 tub (8 oz.) COOL WHIP Whipped Topping, thawed, ""1 oz. BAKERS Semi-Sweet Chocolate, grated""",False
regional,"Chicken Tetrazzini Florentine: A complicated name for an easy way to get a hot, cheesy chicken and pasta bake on the table!",1.0,Chicken Tetrazzini Florentine.jpg,"1/2 lb. spaghetti, uncooked, broken into thirds, 1 pkg. (6 oz.) baby spinach leaves, 3 Tbsp. butter, 1 onion, chopped, 1/2 lb. sliced fresh mushrooms, 3 Tbsp. flour, 1-1/2 cups fat-free reduced-sodium chicken broth, 1 tub (8 oz.) PHILADELPHIA Cream Cheese Spread, 2 Tbsp. milk, 1 tsp. dried Italian seasoning, 1/2 tsp. garlic powder, 2 cups shredded cooked chicken, 6 Tbsp. KRAFT Grated Parmesan Cheese, divided, 1-1/2 cups KRAFT Shredded Mozzarella Cheese with a TOUCH OF PHILADELPHIA","1/2 lb. spaghetti, uncooked, broken into thirds, 1 pkg. (6 oz.) baby spinach leaves, 3 Tbsp. butter, 1 onion, chopped, 1/2 lb. sliced fresh mushrooms, 3 Tbsp. flour, 1-1/2 cups fat-free reduced-sodium chicken broth, 1 tub (8 oz.) PHILADELPHIA Cream Cheese Spread, 2 Tbsp. milk, 1 tsp. dried Italian seasoning, 1/2 tsp. garlic powder, 2 cups shredded cooked chicken, 6 Tbsp. KRAFT Grated Parmesan Cheese, divided, 1-1/2 cups KRAFT Shredded Mozzarella Cheese with a TOUCH OF PHILADELPHIA",European Recipes,Chicken Tetrazzini Florentine,"1/2 lb. spaghetti, uncooked, broken into thirds, 1 pkg. (6 oz.) baby spinach leaves, 3 Tbsp. butter, 1 onion, chopped, 1/2 lb. sliced fresh mushrooms, 3 Tbsp. flour, 1-1/2 cups fat-free reduced-sodium chicken broth, 1 tub (8 oz.) PHILADELPHIA Cream Cheese Spread, 2 Tbsp. milk, 1 tsp. dried Italian seasoning, 1/2 tsp. garlic powder, 2 cups shredded cooked chicken, 6 Tbsp. KRAFT Grated Parmesan Cheese, divided, 1-1/2 cups KRAFT Shredded Mozzarella Cheese with a TOUCH OF PHILADELPHIA",False
regional,Sprinkle these Cheddar & Sour Cream Scones with parmesan & chives as a finishing touch. These sour cream scones emerge from the oven flaky & golden brown.,27.0,Cheddar & Sour Cream Scones.jpg,"2 cups flour, 1 tsp. cream of tartar, 1/2 tsp. baking soda, 1/2 tsp. salt, 1/4 cup cold butter, cut up, 1 cup KRAFT Shredded Sharp Cheddar Cheese, ""1/2 cup BREAKSTONES or KNUDSEN Sour Cream"", 1/3 cup milk, 1 egg, beaten, 3 Tbsp. KRAFT Grated Parmesan Cheese, 1 Tbsp. minced fresh chives","2 cups flour, 1 tsp. cream of tartar, 1/2 tsp. baking soda, 1/2 tsp. salt, 1/4 cup cold butter, cut up, 1 cup KRAFT Shredded Sharp Cheddar Cheese, ""1/2 cup BREAKSTONES or KNUDSEN Sour Cream"", 1/3 cup milk, 1 egg, beaten, 3 Tbsp. KRAFT Grated Parmesan Cheese, 1 Tbsp. minced fresh chives",European Recipes,Cheddar & Sour Cream Scones,"2 cups flour, 1 tsp. cream of tartar, 1/2 tsp. baking soda, 1/2 tsp. salt, 1/4 cup cold butter, cut up, 1 cup KRAFT Shredded Sharp Cheddar Cheese, ""1/2 cup BREAKSTONES or KNUDSEN Sour Cream"", 1/3 cup milk, 1 egg, beaten, 3 Tbsp. KRAFT Grated Parmesan Cheese, 1 Tbsp. minced fresh chives",False
regional,"Got four perfectly ripened plantains? Use them to make our Healthy Living piñon. It's one tasty casserole that feeds twelve, deliciously!",1.0,Our Favorite Piñon.jpg,"4 ripe plantain s (2-1/2 lb.), 1/3 cup KRAFT Zesty Italian Dressing, divided, 1 green pepper, chopped, 1 small onion, chopped, 1/4 cup chopped green olive s, 2 cloves garlic, minced, 1/3 cup chopped fresh cilantro, divided, 2 lb. extra-lean ground beef, 1 can (8 oz.) tomato sauce, 2 pkt. seasoning with coriander and annatto, 1 can (14.5 oz.) cut green beans, drained, 1 pkg. (7 oz.) KRAFT 2% Milk Shredded Mozzarella Cheese, 2 whole egg s, 2 egg white s, 1/4 cup fat-free milk","4 ripe plantain s (2-1/2 lb.), 1/3 cup KRAFT Zesty Italian Dressing, divided, 1 green pepper, chopped, 1 small onion, chopped, 1/4 cup chopped green olive s, 2 cloves garlic, minced, 1/3 cup chopped fresh cilantro, divided, 2 lb. extra-lean ground beef, 1 can (8 oz.) tomato sauce, 2 pkt. seasoning with coriander and annatto, 1 can (14.5 oz.) cut green beans, drained, 1 pkg. (7 oz.) KRAFT 2% Milk Shredded Mozzarella Cheese, 2 whole egg s, 2 egg white s, 1/4 cup fat-free milk",Puerto Rican,Our Favorite Piñon,"4 ripe plantain s (2-1/2 lb.), 1/3 cup KRAFT Zesty Italian Dressing, divided, 1 green pepper, chopped, 1 small onion, chopped, 1/4 cup chopped green olive s, 2 cloves garlic, minced, 1/3 cup chopped fresh cilantro, divided, 2 lb. extra-lean ground beef, 1 can (8 oz.) tomato sauce, 2 pkt. seasoning with coriander and annatto, 1 can (14.5 oz.) cut green beans, drained, 1 pkg. (7 oz.) KRAFT 2% Milk Shredded Mozzarella Cheese, 2 whole egg s, 2 egg white s, 1/4 cup fat-free milk",False
regional,"Give ordinary potatoes some creamy, cheesy pizzazz with this Puerto Rican-Style Stuffed Potatoes recipe. Shredded chicken, black olives and cilantro give these Puerto Rican-Style Stuffed Potatoes their delicious flavor.",115.0,Puerto Rican-Style Stuffed Potatoes.jpg,"2 lb. white potato es (about 8), peeled, quartered, 15 RITZ Crackers, crushed, 2 Tbsp. KRAFT Zesty Italian Dressing, 1 small red pepper, finely chopped, 1/4 cup finely chopped fresh cilantro, 1-1/4 cups shredded cooked chicken, 5 pitted black olives, chopped, 2/3 cup KRAFT Shredded Sharp Cheddar Cheese, 2 cups oil, 2 Tbsp. flour","2 lb. white potato es (about 8), peeled, quartered, 15 RITZ Crackers, crushed, 2 Tbsp. KRAFT Zesty Italian Dressing, 1 small red pepper, finely chopped, 1/4 cup finely chopped fresh cilantro, 1-1/4 cups shredded cooked chicken, 5 pitted black olives, chopped, 2/3 cup KRAFT Shredded Sharp Cheddar Cheese, 2 cups oil, 2 Tbsp. flour",Puerto Rican,Puerto Rican-Style Stuffed Potatoes,"2 lb. white potato es (about 8), peeled, quartered, 15 RITZ Crackers, crushed, 2 Tbsp. KRAFT Zesty Italian Dressing, 1 small red pepper, finely chopped, 1/4 cup finely chopped fresh cilantro, 1-1/4 cups shredded cooked chicken, 5 pitted black olives, chopped, 2/3 cup KRAFT Shredded Sharp Cheddar Cheese, 2 cups oil, 2 Tbsp. flour",True
regional,"Inspired from a traditional Puerto Rican comforting meat pie, this flavorful dish is filled with layers of melted VELVEETA, flavored meat and fried plantains.",75.0,Pastelon.jpg,"2 Tbsp. KRAFT Zesty Italian Dressing, 4 ripe yellow plantain s (1-1/2 lb.), peeled, cut lengthwise into 1/2-inch-thick slices, 6 slices OSCAR MAYER Bacon, chopped, 1 onion, chopped, 1 green pepper, chopped, 1 lb. ground beef, 1 can (8 oz.) tomato sauce, 2 Tbsp. sofrito sauce with tomato, 2 tsp. capers, 4 green olive s, sliced, 1/2 lb. (8 oz.) VELVEETA®, cut into 1/2-inch cubes","2 Tbsp. KRAFT Zesty Italian Dressing, 4 ripe yellow plantain s (1-1/2 lb.), peeled, cut lengthwise into 1/2-inch-thick slices, 6 slices OSCAR MAYER Bacon, chopped, 1 onion, chopped, 1 green pepper, chopped, 1 lb. ground beef, 1 can (8 oz.) tomato sauce, 2 Tbsp. sofrito sauce with tomato, 2 tsp. capers, 4 green olive s, sliced, 1/2 lb. (8 oz.) VELVEETA®, cut into 1/2-inch cubes",Puerto Rican,Pastelon,"2 Tbsp. KRAFT Zesty Italian Dressing, 4 ripe yellow plantain s (1-1/2 lb.), peeled, cut lengthwise into 1/2-inch-thick slices, 6 slices OSCAR MAYER Bacon, chopped, 1 onion, chopped, 1 green pepper, chopped, 1 lb. ground beef, 1 can (8 oz.) tomato sauce, 2 Tbsp. sofrito sauce with tomato, 2 tsp. capers, 4 green olive s, sliced, 1/2 lb. (8 oz.) VELVEETA®, cut into 1/2-inch cubes",False
regional,Celebrate any special occasion with our Pecan Rum Cake Recipe! Get out your fluted tube pan and some pecans to make this moist and nutty rum cake recipe.,85.0,Pecan Rum Cake Recipe.jpg,"1 cup PLANTERS Pecan Halves, coarsely chopped, 1 pkg. (2-layer size) yellow cake mix, 4 egg s, ""1 cup BREAKSTONES or KNUDSEN Sour Cream"", 3/4 cup dark rum, divided, 1/2 cup oil, 1/2 cup sugar, 1/4 cup (1/2 stick) butter or margarine","1 cup PLANTERS Pecan Halves, coarsely chopped, 1 pkg. (2-layer size) yellow cake mix, 4 egg s, ""1 cup BREAKSTONES or KNUDSEN Sour Cream"", 3/4 cup dark rum, divided, 1/2 cup oil, 1/2 cup sugar, 1/4 cup (1/2 stick) butter or margarine",Puerto Rican,Pecan Rum Cake Recipe,"1 cup PLANTERS Pecan Halves, coarsely chopped, 1 pkg. (2-layer size) yellow cake mix, 4 egg s, ""1 cup BREAKSTONES or KNUDSEN Sour Cream"", 3/4 cup dark rum, divided, 1/2 cup oil, 1/2 cup sugar, 1/4 cup (1/2 stick) butter or margarine",False
regional,"Whether you call it Asapao con Camarones or Puerto Rican Shrimp & Rice, this recipe is a quick and delicious way to please four.",40.0,Puerto Rican Shrimp & Rice (Asapao con Camarones).jpg,"1 tsp. each: ground allspice, ground coriander and dried oregano leaves, 1 lb. large shrimp (26 to 30 count), cleaned, 1/4 cup KRAFT Zesty Italian Dressing, 1 cup chopped onions, 1 cup white rice, uncooked, 1 can (14-1/2 oz.) vegetable broth, 1/2 cup water, 1 can (14-1/2 oz.) stewed tomatoes, undrained, 1 medium green pepper, chopped (about 1 cup), 3 slices OSCAR MAYER Smoked Ham, chopped","1 tsp. each: ground allspice, ground coriander and dried oregano leaves, 1 lb. large shrimp (26 to 30 count), cleaned, 1/4 cup KRAFT Zesty Italian Dressing, 1 cup chopped onions, 1 cup white rice, uncooked, 1 can (14-1/2 oz.) vegetable broth, 1/2 cup water, 1 can (14-1/2 oz.) stewed tomatoes, undrained, 1 medium green pepper, chopped (about 1 cup), 3 slices OSCAR MAYER Smoked Ham, chopped",Puerto Rican,Puerto Rican Shrimp & Rice (Asapao con Camarones),"1 tsp. each: ground allspice, ground coriander and dried oregano leaves, 1 lb. large shrimp (26 to 30 count), cleaned, 1/4 cup KRAFT Zesty Italian Dressing, 1 cup chopped onions, 1 cup white rice, uncooked, 1 can (14-1/2 oz.) vegetable broth, 1/2 cup water, 1 can (14-1/2 oz.) stewed tomatoes, undrained, 1 medium green pepper, chopped (about 1 cup), 3 slices OSCAR MAYER Smoked Ham, chopped",False
regional,"Need an appetizer that will get the whole party talking? Try topping fried plantain slices with sautéed shrimp, avocados and spicy mayo!",40.0,Chipotle Shrimp & Avocado Tostones.jpg,"8 uncooked deveined peeled medium shrimp, 2 Tbsp. KRAFT Chipotle Aioli, divided, 3 Tbsp. oil, divided, 1 large green plantain, cut into 16 slices, 1 small fully ripe avocado, 1 Tbsp. fresh lime juice, ""1 Tbsp. BREAKSTONES or KNUDSEN Sour Cream"", 2 Tbsp. chopped fresh cilantro, divided","8 uncooked deveined peeled medium shrimp, 2 Tbsp. KRAFT Chipotle Aioli, divided, 3 Tbsp. oil, divided, 1 large green plantain, cut into 16 slices, 1 small fully ripe avocado, 1 Tbsp. fresh lime juice, ""1 Tbsp. BREAKSTONES or KNUDSEN Sour Cream"", 2 Tbsp. chopped fresh cilantro, divided",Puerto Rican,Chipotle Shrimp & Avocado Tostones,"8 uncooked deveined peeled medium shrimp, 2 Tbsp. KRAFT Chipotle Aioli, divided, 3 Tbsp. oil, divided, 1 large green plantain, cut into 16 slices, 1 small fully ripe avocado, 1 Tbsp. fresh lime juice, ""1 Tbsp. BREAKSTONES or KNUDSEN Sour Cream"", 2 Tbsp. chopped fresh cilantro, divided",False
regional,Rake in loads of compliments with our Creamy Coconut Flan recipe. The sumptuous taste of this Cream Coconut Flan is topped off with juicy strawberries.,375.0,Creamy Coconut Flan.jpg,"1 cup sugar, divided, 1/4 cup water, 1 can (14 oz. ) coconut milk, 1 pkg. (8 oz.) PHILADELPHIA Cream Cheese, cubed, softened, 4 eggs, 3 strawberries, halved","1 cup sugar, divided, 1/4 cup water, 1 can (14 oz. ) coconut milk, 1 pkg. (8 oz.) PHILADELPHIA Cream Cheese, cubed, softened, 4 eggs, 3 strawberries, halved",Puerto Rican,Creamy Coconut Flan,"1 cup sugar, divided, 1/4 cup water, 1 can (14 oz. ) coconut milk, 1 pkg. (8 oz.) PHILADELPHIA Cream Cheese, cubed, softened, 4 eggs, 3 strawberries, halved",False
regional,"In the mood for Caribbean tonight? Try this delish chicken dish served with savory rice and peas, and you might be in that mood more frequently.",45.0,"Crispy Chicken with Annatto Sauce, Rice & Pigeon Peas.jpg","4 slices OSCAR MAYER Bacon, cut into 1/2-inch pieces, 1 can (14-1/2 oz.) diced tomatoes with green pepper, celery and onion, undrained, 1/2 cup water, 1 cup rice, uncooked, 1 can (15 oz.) pigeon peas, drained, 1-1/2 lb. skin-on boneless chicken breasts, cut into 2-inch pieces, 1 tsp. annatto paste, dissolved in 1 tsp. water, 1/4 cup KRAFT Real Mayo Mayonnaise, 1 clove garlic, minced","4 slices OSCAR MAYER Bacon, cut into 1/2-inch pieces, 1 can (14-1/2 oz.) diced tomatoes with green pepper, celery and onion, undrained, 1/2 cup water, 1 cup rice, uncooked, 1 can (15 oz.) pigeon peas, drained, 1-1/2 lb. skin-on boneless chicken breasts, cut into 2-inch pieces, 1 tsp. annatto paste, dissolved in 1 tsp. water, 1/4 cup KRAFT Real Mayo Mayonnaise, 1 clove garlic, minced",Puerto Rican,"Crispy Chicken with Annatto Sauce, Rice & Pigeon Peas","4 slices OSCAR MAYER Bacon, cut into 1/2-inch pieces, 1 can (14-1/2 oz.) diced tomatoes with green pepper, celery and onion, undrained, 1/2 cup water, 1 cup rice, uncooked, 1 can (15 oz.) pigeon peas, drained, 1-1/2 lb. skin-on boneless chicken breasts, cut into 2-inch pieces, 1 tsp. annatto paste, dissolved in 1 tsp. water, 1/4 cup KRAFT Real Mayo Mayonnaise, 1 clove garlic, minced",True
regional,"This savory pigeon pea soup tastes wonderful with our garlicky plantain dumplings. Read on for the recipe—and for plantain how-to tips, too.",50.0,Pigeon Pea Soup with Plantain Dumplings.jpg,"2 green plantains, peeled, finely shredded, 3 cloves garlic, chopped, divided, 1 Tbsp. oil, 1 onion, chopped, 1 green pepper, finely chopped, 1/2 cup chopped fresh cilantro, divided, 2 cans (15 oz. each) pigeon peas, drained, 1 can (8 oz.) tomato sauce, 3 qt. (12 cups) water, 3 cubes chicken bouillon, 2 cups cubed butternut squash (1 inch), 1/2 cup short-grain white rice, uncooked, 4 oz. OSCAR MAYER Smoked Ham, chopped, 1/4 cup chopped green olives","2 green plantains, peeled, finely shredded, 3 cloves garlic, chopped, divided, 1 Tbsp. oil, 1 onion, chopped, 1 green pepper, finely chopped, 1/2 cup chopped fresh cilantro, divided, 2 cans (15 oz. each) pigeon peas, drained, 1 can (8 oz.) tomato sauce, 3 qt. (12 cups) water, 3 cubes chicken bouillon, 2 cups cubed butternut squash (1 inch), 1/2 cup short-grain white rice, uncooked, 4 oz. OSCAR MAYER Smoked Ham, chopped, 1/4 cup chopped green olives",Puerto Rican,Pigeon Pea Soup with Plantain Dumplings,"2 green plantains, peeled, finely shredded, 3 cloves garlic, chopped, divided, 1 Tbsp. oil, 1 onion, chopped, 1 green pepper, finely chopped, 1/2 cup chopped fresh cilantro, divided, 2 cans (15 oz. each) pigeon peas, drained, 1 can (8 oz.) tomato sauce, 3 qt. (12 cups) water, 3 cubes chicken bouillon, 2 cups cubed butternut squash (1 inch), 1/2 cup short-grain white rice, uncooked, 4 oz. OSCAR MAYER Smoked Ham, chopped, 1/4 cup chopped green olives",False
regional,"Make our marvelous Mofongo Recipe for a delicious Puerto Rican dish! Our Mofongo Recipe includes green plantains, rich garlic, smoked bacon and more.",30.0,Mofongo Recipe.jpg,"2 cups oil, 4 green plantain s (1-1/2 lb.), peeled, cut into 1/2-inch pieces, 1/4 cup KRAFT Zesty Lime Vinaigrette Dressing, 3 cloves garlic, minced, 8 slices OSCAR MAYER Butcher Thick Cut Applewood Smoked Bacon, cooked, crumbled, 1/2 cup fat-free reduced-sodium chicken broth, heated, divided","2 cups oil, 4 green plantain s (1-1/2 lb.), peeled, cut into 1/2-inch pieces, 1/4 cup KRAFT Zesty Lime Vinaigrette Dressing, 3 cloves garlic, minced, 8 slices OSCAR MAYER Butcher Thick Cut Applewood Smoked Bacon, cooked, crumbled, 1/2 cup fat-free reduced-sodium chicken broth, heated, divided",Puerto Rican,Mofongo Recipe,"2 cups oil, 4 green plantain s (1-1/2 lb.), peeled, cut into 1/2-inch pieces, 1/4 cup KRAFT Zesty Lime Vinaigrette Dressing, 3 cloves garlic, minced, 8 slices OSCAR MAYER Butcher Thick Cut Applewood Smoked Bacon, cooked, crumbled, 1/2 cup fat-free reduced-sodium chicken broth, heated, divided",False
regional,Cook up this Sri-Lankan Fish Curry and serve with dinner. This rich and hearty curry pairs great with a mixed green salad and can be made in 45 minutes!,45.0,Sri-Lankan Fish Curry.jpg,"1/2 cup water, 1 Tbsp. seedless tamarind (about 1-inch piece), 1/2 cup canned coconut milk, 1/4 cup KRAFT Sun Dried Tomato Vinaigrette Dressing, 1/2 tsp. ground red pepper (cayenne), 1/2 tsp. ground turmeric, 1 Tbsp. oil, 1 onion, finely chopped, 2 fresh green chiles, sliced, 20 fresh curry leaves, 2 cloves garlic, minced, 1 Tbsp. minced gingerroot, 1/2 tsp. fennel seed, 1/2 tsp. black mustard seed, 2 tomatoes, chopped, 1-1/2 lb. halibut fillet, cut into 2-inch chunks","1/2 cup water, 1 Tbsp. seedless tamarind (about 1-inch piece), 1/2 cup canned coconut milk, 1/4 cup KRAFT Sun Dried Tomato Vinaigrette Dressing, 1/2 tsp. ground red pepper (cayenne), 1/2 tsp. ground turmeric, 1 Tbsp. oil, 1 onion, finely chopped, 2 fresh green chiles, sliced, 20 fresh curry leaves, 2 cloves garlic, minced, 1 Tbsp. minced gingerroot, 1/2 tsp. fennel seed, 1/2 tsp. black mustard seed, 2 tomatoes, chopped, 1-1/2 lb. halibut fillet, cut into 2-inch chunks",Asian Recipes,Sri-Lankan Fish Curry,"1/2 cup water, 1 Tbsp. seedless tamarind (about 1-inch piece), 1/2 cup canned coconut milk, 1/4 cup KRAFT Sun Dried Tomato Vinaigrette Dressing, 1/2 tsp. ground red pepper (cayenne), 1/2 tsp. ground turmeric, 1 Tbsp. oil, 1 onion, finely chopped, 2 fresh green chiles, sliced, 20 fresh curry leaves, 2 cloves garlic, minced, 1 Tbsp. minced gingerroot, 1/2 tsp. fennel seed, 1/2 tsp. black mustard seed, 2 tomatoes, chopped, 1-1/2 lb. halibut fillet, cut into 2-inch chunks",False
regional,"A bed of salad greens is topped with slices of broiled steak, corn, beans, baked cream cheese and a drizzle of Thai-inspired sweet chili sauce.",41.0,Thai Chili Steak Salad.jpg,"6 oz. (3/4 of 8-oz. pkg.) PHILADELPHIA Cream Cheese, 1 beef sirloin steak (1 lb.), 1/2 inch thick, 1 pkg. (6 oz.) torn mixed salad greens, 2 cups fresh green beans, blanched, 3/4 cup baby corn, 1 small red onion, slivered, 1/4 cup sweet chili sauce, 2 Tbsp. HEINZ Distilled White Vinegar, 2 Tbsp. oil, 2 Tbsp. chopped fresh mint, 2 Tbsp. chopped fresh cilantro, 1 tsp. lime zest, 1/4 cup PLANTERS Dry Roasted Unsalted Peanuts","6 oz. (3/4 of 8-oz. pkg.) PHILADELPHIA Cream Cheese, 1 beef sirloin steak (1 lb.), 1/2 inch thick, 1 pkg. (6 oz.) torn mixed salad greens, 2 cups fresh green beans, blanched, 3/4 cup baby corn, 1 small red onion, slivered, 1/4 cup sweet chili sauce, 2 Tbsp. HEINZ Distilled White Vinegar, 2 Tbsp. oil, 2 Tbsp. chopped fresh mint, 2 Tbsp. chopped fresh cilantro, 1 tsp. lime zest, 1/4 cup PLANTERS Dry Roasted Unsalted Peanuts",Asian Recipes,Thai Chili Steak Salad,"6 oz. (3/4 of 8-oz. pkg.) PHILADELPHIA Cream Cheese, 1 beef sirloin steak (1 lb.), 1/2 inch thick, 1 pkg. (6 oz.) torn mixed salad greens, 2 cups fresh green beans, blanched, 3/4 cup baby corn, 1 small red onion, slivered, 1/4 cup sweet chili sauce, 2 Tbsp. HEINZ Distilled White Vinegar, 2 Tbsp. oil, 2 Tbsp. chopped fresh mint, 2 Tbsp. chopped fresh cilantro, 1 tsp. lime zest, 1/4 cup PLANTERS Dry Roasted Unsalted Peanuts",False
regional,"Make tonight one to remember with our Asparagus-Beef Ramen Bowl. This colorful asparagus-beef bowl is a great mix of sirloin steak, veggies and noodles.",25.0,Asparagus-Beef Ramen Bowl.jpg,"1/4 lb. thin whole wheat spaghetti, uncooked, 1/2 lb. fresh asparagus spears, cut diagonally into 1-inch lengths, 1/2 red pepper, cut into thin strips, 1 carrot, sliced, 1 lb. boneless beef sirloin steak, cut into thin strips, 2 cloves garlic, minced, 1/4 cup KRAFT Asian Toasted Sesame Dressing, divided, 2 Tbsp. HEINZ Ketchup Blended with Sriracha Flavor, 1 Tbsp. lite soy sauce","1/4 lb. thin whole wheat spaghetti, uncooked, 1/2 lb. fresh asparagus spears, cut diagonally into 1-inch lengths, 1/2 red pepper, cut into thin strips, 1 carrot, sliced, 1 lb. boneless beef sirloin steak, cut into thin strips, 2 cloves garlic, minced, 1/4 cup KRAFT Asian Toasted Sesame Dressing, divided, 2 Tbsp. HEINZ Ketchup Blended with Sriracha Flavor, 1 Tbsp. lite soy sauce",Asian Recipes,Asparagus-Beef Ramen Bowl,"1/4 lb. thin whole wheat spaghetti, uncooked, 1/2 lb. fresh asparagus spears, cut diagonally into 1-inch lengths, 1/2 red pepper, cut into thin strips, 1 carrot, sliced, 1 lb. boneless beef sirloin steak, cut into thin strips, 2 cloves garlic, minced, 1/4 cup KRAFT Asian Toasted Sesame Dressing, divided, 2 Tbsp. HEINZ Ketchup Blended with Sriracha Flavor, 1 Tbsp. lite soy sauce",True
regional,Give your grilled teriyaki chicken more taste with ramen. Grilled Teriyaki Chicken with Ramen Noodles is chock full of delicious Asian-style flavor.,90.0,Grilled Teriyaki Chicken with Ramen Noodles.jpg,"1/2 cup KRAFT Asian Toasted Sesame Dressing, 1/4 cup lite soy sauce, 2 Tbsp. brown sugar, 2 Tbsp. minced gingerroot, 4 cloves garlic, minced, 4 small boneless skinless chicken breasts (1 lb.), 2 pkg. (3 oz. each) ramen noodle soup mix, any flavor, 1 pkg. (16 oz.) refrigerated pre-cut mixed stir-fry vegetables (broccoli, carrots, green and red peppers, onions, snow peas), 2-1/2 cups fat-free reduced-sodium chicken broth, 1/4 cup PLANTERS Dry Roasted Peanuts","1/2 cup KRAFT Asian Toasted Sesame Dressing, 1/4 cup lite soy sauce, 2 Tbsp. brown sugar, 2 Tbsp. minced gingerroot, 4 cloves garlic, minced, 4 small boneless skinless chicken breasts (1 lb.), 2 pkg. (3 oz. each) ramen noodle soup mix, any flavor, 1 pkg. (16 oz.) refrigerated pre-cut mixed stir-fry vegetables (broccoli, carrots, green and red peppers, onions, snow peas), 2-1/2 cups fat-free reduced-sodium chicken broth, 1/4 cup PLANTERS Dry Roasted Peanuts",Asian Recipes,Grilled Teriyaki Chicken with Ramen Noodles,"1/2 cup KRAFT Asian Toasted Sesame Dressing, 1/4 cup lite soy sauce, 2 Tbsp. brown sugar, 2 Tbsp. minced gingerroot, 4 cloves garlic, minced, 4 small boneless skinless chicken breasts (1 lb.), 2 pkg. (3 oz. each) ramen noodle soup mix, any flavor, 1 pkg. (16 oz.) refrigerated pre-cut mixed stir-fry vegetables (broccoli, carrots, green and red peppers, onions, snow peas), 2-1/2 cups fat-free reduced-sodium chicken broth, 1/4 cup PLANTERS Dry Roasted Peanuts",False
