category,description,imageName,ingredients,procedure,subcategory,title,times,isFavorite
regional,Please the pizza lovers with Oven-Baked Pepperoni Pizza Bread. Juicy plum tomatoes and Parmesan make this Oven-Baked Pepperoni Pizza Bread a crowd fave!,Oven-Baked Pepperoni Pizza Bread.jpg,"['1 French bread baguette (9 oz.), cut into 1/2-inch-thick slices', '4 plum tomatoes, cut into 1/4-inch-thick slices', '1-1/2 cups CLASSICO Tomato and Basil Pasta Sauce', '1/4 lb. stick pepperoni, cut lengthwise into quarters, then sliced crosswise', '1 cup KRAFT Shredded Italian* Five Cheese Blend', '2 Tbsp. KRAFT Grated Parmesan Cheese']","['Heat oven to 400ºF.', 'Place bread slices in single layer on baking sheets. Bake 5 min. or until lightly browned.', 'Layer bread slices and tomato slices alternately in large cast-iron pan, overlapping rows as necessary to fit; cover with pasta sauce.', 'Top with pepperoni and cheeses; cover.', 'Bake 30 min. or until heated through, uncovering after 20 min.']",European Recipes,Oven-Baked Pepperoni Pizza Bread,"['02/19/2019, 23:08:16', '09/03/2018, 19:14:58', '11/17/2018, 08:20:52', '12/13/2018, 09:53:38']",False
regional,Experience the delicious flavor of this Oven-Roasted Root Vegetables & Apples dish. This savory Oven-Roasted Root Vegetables & Apples is a guaranteed hit!,Oven-Roasted Root Vegetables & Apples.jpg,"['5 carrots (1/2 lb.), peeled', '1 lb. parsnips, peeled, diagonally sliced', '1/4 cup KRAFT Zesty Italian Dressing', '1 tsp. orange zest', '1/4 tsp. ground red pepper (cayenne)', '2 Gala apples, each cut into 8 wedges', '1/2 cup KRAFT Shredded Parmesan Cheese']","['Heat oven to 425ºF.', 'Cut carrots lengthwise, then crosswise in half; place in large bowl. Add parsnips.', 'Mix dressing, orange zest and red pepper until blended. Drizzle over vegetables; toss to evenly coat. Spread onto rimmed baking sheet sprayed with cooking spray.', 'Bake 20 min.', 'Add apples and cheese to baking sheet; stir to combine. Bake 15 to 20 min. or until vegetables and apples are tender.']",European Recipes,Oven-Roasted Root Vegetables & Apples,"['05/28/2019, 09:07:11', '06/19/2018, 00:26:46', '08/17/2018, 14:23:45']",False
regional,Combine ricotta and sweetened cream for Panna Cotta. Our Italian Panna Cotta recipe is best served chilled with a pureed berry sauce.,Panna Cotta.jpg,"['1 env. KNOX Unflavored Gelatine', '1-1/2 cups half-and-half, divided', '1/2 cup sugar', '1/2 tsp. vanilla', '2 cups POLLY-O Original Ricotta Cheese', '1-1/2 cups mixed assorted fresh berries (blueberries, raspberries and strawberries)']","['Sprinkle gelatine over 1/2 cup half-and-half in medium saucepan; let stand 5 min. or until softened. Stir in sugar, vanilla and remaining half-and-half; cook on low heat until gelatine is completely dissolved, stirring frequently. (Do not boil.)', 'Place gelatine mixture into blender. Add ricotta; blend until smooth. Pour into 8 (6-oz.) custard cups sprayed with cooking spray. Refrigerate 2 hours or until firm.', 'Blend berries in blender until smooth; spoon onto 8 dessert plates. Top with unmolded desserts.']",European Recipes,Panna Cotta,"['10/28/2018, 15:12:58']",False
regional,Think a biscotti recipe is hard to make? Think again! This nearly foolproof White Chocolate-Cranberry Biscotti Recipe makes the perfect hostess gift.,White Chocolate-Cranberry Biscotti Recipe.jpg,"['2 cups flour', '1-1/2 tsp. CALUMET Baking Powder', '1 tsp. lime zest', '1/4 tsp. salt', '1/2 cup butter, softened', '3/4 cup sugar', '2 eggs', '1 tsp. vanilla', ""1 pkg. (4 oz.) BAKER'S White Chocolate, chopped"", '3/4 cup PLANTERS Slivered Almonds, chopped', '1/2 cup dried cranberries', ""1 pkg. (4 oz.) BAKER'S Semi-Sweet Chocolate""]","['Heat oven to 325°F.', 'Combine flour, baking powder, lime zest and salt. Beat butter and sugar in large bowl with mixer until light and fluffy. Blend in eggs and vanilla. Gradually add flour mixture, beating well after each addition. Stir in white chocolate, nuts and cranberries.', 'Divide dough in half. Use lightly floured hands to roll each half into 14-inch log; place on baking sheet sprayed with cooking spray.', 'Bake 25 to 30 min. or until lightly browned. Transfer biscotti to cutting board; cool 10 min. Use serrated knife to diagonally cut each log into 12 slices; place upright on baking sheet. Bake 15 to 18 min. or until slightly dried. Remove to wire racks; cool completely.', 'Melt semi-sweet chocolate as directed on package. Dip tips of cooled biscotti in melted chocolate, then place in single layer on waxed paper; let stand until chocolate is firm.']",European Recipes,White Chocolate-Cranberry Biscotti Recipe,"['07/29/2018, 07:25:24']",False
regional,"Discover the complex, rich taste of our Chocolate Stout Cake. This Chocolate Stout Cake is made complete with a deliciously sweet brown butter frosting.",Chocolate Stout Cake.jpg,"['2 eggs', ""2/3 cup BREAKSTONE'S or KNUDSEN Sour Cream"", '1-1/2 tsp. vanilla, divided', '2 cups flour', '2-1/2 tsp. baking soda', '2 cups dry stout', '1-1/4 cups butter, divided', '2 cups granulated sugar', '3/4 cup unsweetened cocoa powder', '1 pkg. (8 oz.) PHILADELPHIA Cream Cheese, softened', '2-1/2 cups powdered sugar']","['Heat oven to 350ºF.', 'Whisk eggs, sour cream and 1/2 tsp. vanilla until blended. Set aside. Combine flour and baking soda in large bowl.', 'Cook stout and 1 cup butter in large saucepan 2 to 3 min. or until butter is melted and mixture is well blended, stirring frequently. Remove from heat. Add granulated sugar and cocoa powder; mix well. Stir in egg mixture until blended. Add flour mixture; mix well.', 'Pour into 2 greased and floured (9-inch) round pans.', 'Bake 35 to 40 min. or until toothpick inserted in centers comes out clean. Cool 10 min. Remove cake layers from pans to wire racks; cool completely.', 'Meanwhile, bring remaining butter just to boil in saucepan; simmer on medium-low heat 3 min. or until lightly browned. Cool.', 'Beat cream cheese, powdered sugar and remaining vanilla in large bowl with mixer until blended. Gradually blend in butter, being careful to not add sediment from bottom of pan; discard sediment.', 'Stack cake layers, filling layers and frosting top of cake with cream cheese mixture.']",European Recipes,Chocolate Stout Cake,"['03/04/2019, 00:17:18']",True
regional,"Fresh gingerroot, ground annatto and ground cumin are just some of the aromatic, flavorful ingredients you'll find in this Healthy Living shrimp dish.",Criollo Shrimp.jpg,"['1 onion, sliced into thin rings', '1 red pepper, sliced', '1 Tbsp. finely chopped fresh gingerroot', '1/2 cup KRAFT Zesty Italian Dressing', '1 Tbsp. GREY POUPON Dijon Mustard', '1 tsp. ground annatto', '1/2 tsp. ground cumin', '1 lb. large shrimp, cleaned, butterflied', '2 cups cooked white rice']","['Cook onion, red pepper and gingerroot in dressing in large skillet on medium-high heat 5 min. or until onion is tender.', 'Stir in mustard, annatto and cumin until blended.', 'Add shrimp; cook 3 to 5 min. or until shrimp turn pink and are cooked through. Serve over rice.']",European Recipes,Criollo Shrimp,"['12/10/2018, 17:05:54']",True
regional,Have the recipe for this Caramelized Onion Tart ready when you bring it to potlucks. People will want to make their own Caramelized Onion Tart!,Caramelized Onion Tart.jpg,"['3 onion s, thinly sliced', '2 Tbsp. oil', '1 clove garlic, minced', '1/4 tsp. dried thyme leaves', '1/4 tsp. salt', '1 can (13.8 oz.) refrigerated pizza crust', '1/4 cup KRAFT Grated Parmesan Cheese, divided', '3/4 cup pitted Kalamata olives, cut lengthwise in half']","['Cook onions in oil in large skillet on medium heat 15 min. or until golden brown, stirring frequently. Add garlic, thyme and salt; cook and stir 2 min.', 'Heat oven to 400°F. Unroll pizza dough onto baking sheet, stirring frequently; press into 14x12-inch rectangle. Bake 5 min.; sprinkle with half the cheese. Top with onions, olives and remaining cheese.', 'Bake 10 to 12 min. or until edges of crust are golden brown.']",European Recipes,Caramelized Onion Tart,"['02/19/2019, 12:20:19', '08/15/2019, 22:24:33', '08/29/2018, 11:21:21']",False
regional,"Feta cheese and a squeeze of fresh lemon give this Greek Antipasto Dip its Mediterranean flavor. For still more, add chopped kalamata or black olives.",Greek Antipasto Dip.jpg,"['1 tub (8 oz.) PHILADELPHIA 1/3 Less Fat than Cream Cheese', '1 clove garlic, minced', '1/3 cup chopped drained roasted red pepper s', '1/4 cup finely chopped red onion s', '1 Tbsp. olive oil', '1/4 cup ATHENOS Crumbled Reduced Fat Feta Cheese', '1/2 small lemon, seeded', '1 Tbsp. minced fresh parsley', 'large thin wheat snack crackers']","['Heat oven to 350ºF.', 'Mix reduced-fat cream cheese and garlic; spread onto bottom of 9-inch pie plate.', 'Cover with peppers and onions. Drizzle with oil; top with feta.', 'Bake 10 to 12 min. or until heated through. Squeeze lemon over dip. Sprinkle with parsley. Serve with crackers.']",European Recipes,Greek Antipasto Dip,"['06/25/2018, 21:42:55']",True
regional,"Enjoy this Chunky Vegetable Hummus recipe with chopped cucumbers, red onions and plum tomatoes, and a sprinkle of crumbled feta cheese.",Chunky Vegetable Hummus Spread.jpg,"['1 container (7 oz.) ATHENOS Original Hummus', '1/2 cup chopped seeded cucumber s', '1/4 cup finely chopped red onion s', '1 plum tomato, chopped', '1/4 cup ATHENOS Traditional Crumbled Feta Cheese', '3 whole wheat pita bread s (7 inch), torn into 8 pieces each']","['Spread hummus onto plate.', 'Top with layers of all remaining ingredients except bread.', 'Serve with bread.']",European Recipes,Chunky Vegetable Hummus Spread,"['02/05/2019, 02:16:25']",False
regional,"Try our Shrimp Fideo Recipe for an exciting new experience. Our Shrimp Fideo Recipe gets its unique flavor from garlic, cumin and Spanish paprika.",Shrimp Fideo Recipe.jpg,"['1/2 cup KRAFT Real Mayo Mayonnaise', '1/2 cup KRAFT Zesty Italian Dressing, divided', '4 cloves garlic, finely chopped', '1/2 tsp. ground cumin', '1 lb. spaghetti, cooked (about 6 cups cooked)', '2 large green pepper s, seeded, chopped', '1 medium onion, chopped (about 1 cup)', '1-1/2 lb. large shrimp (12 to 18 count), cleaned', '1 can (15 oz.) diced tomatoes, drained', '1 Tbsp. sweet Spanish paprika (pimenton)']","['Mix mayo, 1/4 cup of the dressing, the garlic and cumin in large bowl until well blended. Add pasta; toss to coat. Set aside.', 'Heat remaining 1/4 cup dressing in large skillet on medium-high heat. Add peppers and onions; cook 5 min. or until onions are tender, stirring occasionally. Add shrimp, tomatoes and paprika; stir. Cook 5 to 10 min. or until shrimp turn pink, stirring frequently. Remove from heat.', 'Add to pasta mixture; toss lightly. Serve warm or chilled.']",European Recipes,Shrimp Fideo Recipe,"['01/17/2018, 00:14:47', '10/10/2019, 21:54:26']",False
regional,"If you think cedar-plank grilling is difficult, try this tasty Mediterranean-style chicken recipe. (We'll make a cedar-plank griller out of you, yet!)",Cedar-Planked Mediterranean Chicken.jpg,"['2 untreated cedar plank s (14x7x1 inch each)', '1 cup KRAFT Greek Vinaigrette Dressing', '1/2 cup finely chopped fresh parsley, divided', 'Grated peel and juice of 1 lemon', '4 large bone-in chicken breast s with skin (4 lb.)', '2 Tbsp. oil', '1/4 cup chopped pitted Kalamata olives']","['Immerse planks in water, placing a weight on top of each plank to keep it submerged. Soak at least 4 hours or overnight.', 'Meanwhile, mix dressing, 1/4 cup of the parsley, the lemon zest and juice until well blended. Remove 1/4 cup of the dressing mixture; set aside for later use. Pour remaining dressing mixture into large resealable plastic bag; add chicken. Seal bag; turn over several times to evenly coat chicken with the dressing mixture. Refrigerate at least 2 hours.', 'Preheat grill to medium heat. Remove planks from water; brush tops with oil. Remove chicken from marinade; discard bag and marinade. Place 2 chicken breasts on each plank. Place on grate of grill; cover with lid.', 'Grill 1 to 1-1/4 hours or until chicken is cooked through (165ºF). Meanwhile, mix reserved dressing mixture, remaining 1/4 cup parsley and the olives. Remove chicken from grill; discard planks. Remove bones from chicken; cut each breast in half. Serve topped with the parsley mixture.']",European Recipes,Cedar-Planked Mediterranean Chicken,"['03/27/2019, 09:11:13']",False
regional,It's tiramisu. And it's an easy-to-make pie. This delectable dessert sports layers of creamy pudding and delicate vanilla wafers all drizzled with coffee.,Easy Tiramisu Pie.jpg,"['48 vanilla wafers, divided', '1/4 cup brewed strong MAXWELL HOUSE Coffee, cooled, divided', '4 oz. (1/2 of 8-oz. pkg.) PHILADELPHIA Cream Cheese, softened', '1-1/2 cups cold milk', '1 pkg. (3.4 oz.) JELL-O Vanilla Flavor Instant Pudding', '1 tub (8 oz.) COOL WHIP Whipped Topping, thawed', ""1 oz. BAKER'S Semi-Sweet Chocolate, grated""]","['Arrange 36 wafers on bottom and up side of 9-inch pie plate. Drizzle with 2 Tbsp. coffee.', 'Beat cream cheese in large bowl with mixer until creamy. Gradually beat in milk. Add dry pudding mix; beat 1 min. Gently stir in COOL WHIP.', 'Layer half each of the pudding mixture and grated chocolate in crust; cover with remaining wafers. Drizzle with remaining coffee. Repeat layers of pudding mixture and chocolate. Refrigerate 3 hours.']",European Recipes,Easy Tiramisu Pie,"['10/19/2019, 09:40:03', '10/31/2018, 00:52:10']",False
regional,"Chicken Tetrazzini Florentine: A complicated name for an easy way to get a hot, cheesy chicken and pasta bake on the table!",Chicken Tetrazzini Florentine.jpg,"['1/2 lb. spaghetti, uncooked, broken into thirds', '1 pkg. (6 oz.) baby spinach leaves', '3 Tbsp. butter', '1 onion, chopped', '1/2 lb. sliced fresh mushrooms', '3 Tbsp. flour', '1-1/2 cups fat-free reduced-sodium chicken broth', '1 tub (8 oz.) PHILADELPHIA Cream Cheese Spread', '2 Tbsp. milk', '1 tsp. dried Italian seasoning', '1/2 tsp. garlic powder', '2 cups shredded cooked chicken', '6 Tbsp. KRAFT Grated Parmesan Cheese, divided', '1-1/2 cups KRAFT Shredded Mozzarella Cheese with a TOUCH OF PHILADELPHIA']","['Heat oven to 350°F.', 'Cook spaghetti in large saucepan as directed on package, omitting salt and adding spinach to the boiling water for the last minute.', 'Meanwhile, melt butter in large skillet on medium heat. Add onions; cook and stir 5 min. Stir in mushrooms; cook and stir 4 min. or until mushroom liquid is cooked off. Add flour; cook and stir 1 min. Stir in broth; cook 4 min. or until thickened, stirring constantly.', 'Mix cream cheese spread, milk and seasonings until blended. Drain spaghetti mixture; return to pan. Add cream cheese mixture, mushroom mixture, chicken and 3 Tbsp. Parmesan; mix well. Spoon into 13x9-inch baking dish sprayed with cooking spray; cover.', 'Bake 25 min. Top with mozzarella and remaining Parmesan; bake, uncovered, 8 to 10 min. or until spaghetti mixture is hot and bubbly and mozzarella is melted.']",European Recipes,Chicken Tetrazzini Florentine,"['09/14/2018, 15:52:02', '10/30/2018, 14:07:35']",False
regional,Sprinkle these Cheddar & Sour Cream Scones with parmesan & chives as a finishing touch. These sour cream scones emerge from the oven flaky & golden brown.,Cheddar & Sour Cream Scones.jpg,"['2 cups flour', '1 tsp. cream of tartar', '1/2 tsp. baking soda', '1/2 tsp. salt', '1/4 cup cold butter, cut up', '1 cup KRAFT Shredded Sharp Cheddar Cheese', ""1/2 cup BREAKSTONE'S or KNUDSEN Sour Cream"", '1/3 cup milk', '1 egg, beaten', '3 Tbsp. KRAFT Grated Parmesan Cheese', '1 Tbsp. minced fresh chives']","['Heat oven to 450ºF.', 'Mix first 4 ingredients in large bowl. Cut in butter with pastry blender or 2 knives until mixture resembles coarse crumbs. Stir in cheddar.', 'Make well in center of flour mixture. Mix sour cream and milk. Add to flour mixture; stir with fork just until moistened.', 'Spoon onto parchment-covered baking sheet; pat to 10-inch circle. Cut into 10 wedges. Gently separate wedges; brush with egg. Sprinkle with combined Parmesan and chives.', 'Bake 10 to 12 min. or until golden brown. Serve warm.']",European Recipes,Cheddar & Sour Cream Scones,"['06/03/2019, 07:07:50']",True
regional,"Got four perfectly ripened plantains? Use them to make our Healthy Living piñon. It's one tasty casserole that feeds twelve, deliciously!",Our Favorite Piñon.jpg,"['4 ripe plantain s (2-1/2 lb.)', '1/3 cup KRAFT Zesty Italian Dressing, divided', '1 green pepper, chopped', '1 small onion, chopped', '1/4 cup chopped green olive s', '2 cloves garlic, minced', '1/3 cup chopped fresh cilantro, divided', '2 lb. extra-lean ground beef', '1 can (8 oz.) tomato sauce', '2 pkt. seasoning with coriander and annatto', '1 can (14.5 oz.) cut green beans, drained', '1 pkg. (7 oz.) KRAFT 2% Milk Shredded Mozzarella Cheese', '2 whole egg s', '2 egg white s', '1/4 cup fat-free milk']","['Heat oven to 350ºF.', 'Cut plantains lengthwise into 1/2-inch-thick slices. Heat 2 Tbsp. dressing in large nonstick skillet on medium heat. Add half the plantains; cook 1-1/2 min. on each side or until golden brown on both sides. Remove from skillet; cover to keep warm. Repeat with 2 Tbsp. of the remaining dressing and remaining plantains.', 'Add peppers, onions, olives, garlic, 1/4 cup cilantro and remaining dressing to skillet; cook and stir on medium heat 5 min. or until vegetables are crisp-tender. Stir in meat, tomato sauce and seasoning. Bring to boil, stirring occasionally; simmer on medium-low heat 10 min. or until meat is done, stirring occasionally.', 'Layer half each of the plantains, meat mixture, beans and cheese in 13x9-inch baking dish sprayed with cooking spray; repeat layers. Beat whole eggs, egg whites and milk with whisk until blended; pour over ingredients in baking dish. Cover.', 'Bake 30 min. or until knife inserted in center comes out clean. Sprinkle with remaining cilantro.']",Puerto Rican,Our Favorite Piñon,"['01/08/2019, 01:20:43', '10/22/2019, 00:47:33']",False
regional,"Give ordinary potatoes some creamy, cheesy pizzazz with this Puerto Rican-Style Stuffed Potatoes recipe. Shredded chicken, black olives and cilantro give these Puerto Rican-Style Stuffed Potatoes their delicious flavor.",Puerto Rican-Style Stuffed Potatoes.jpg,"['2 lb. white potato es (about 8), peeled, quartered', '15 RITZ Crackers, crushed', '2 Tbsp. KRAFT Zesty Italian Dressing', '1 small red pepper, finely chopped', '1/4 cup finely chopped fresh cilantro', '1-1/4 cups shredded cooked chicken', '5 pitted black olives, chopped', '2/3 cup KRAFT Shredded Sharp Cheddar Cheese', '2 cups oil', '2 Tbsp. flour']","['Cook potatoes in boiling water 20 min. or until tender; drain. Place in medium bowl. Mash until smooth. Stir in cracker crumbs. Refrigerate 1 hour or until chilled.', 'Heat dressing in medium skillet on medium heat. Add peppers and cilantro; cook 5 min., stirring occasionally. Add chicken and olives; stir. Remove from heat; stir in cheese.', 'Heat oil in medium saucepan to 375ºF. Shape potato mixture into 5-inch patties with lightly floured hands, using about 1/3 cup of the potato mixture for each patty. Spoon about 1/4 cup chicken mixture onto center of each patty. Fold edges of patties over chicken mixture to completely enclose filling. Shape each into oval shape, resembling a large potato. Add, 2 at a time, to hot oil; cook 5 to 6 min. or until golden brown. Drain well. Serve warm.']",Puerto Rican,Puerto Rican-Style Stuffed Potatoes,"['08/02/2019, 04:23:44', '10/18/2019, 14:39:53', '12/22/2018, 19:13:42']",False
regional,"Inspired from a traditional Puerto Rican comforting meat pie, this flavorful dish is filled with layers of melted VELVEETA, flavored meat and fried plantains.",Pastelon.jpg,"['2 Tbsp. KRAFT Zesty Italian Dressing', '4 ripe yellow plantain s (1-1/2 lb.), peeled, cut lengthwise into 1/2-inch-thick slices', '6 slices OSCAR MAYER Bacon, chopped', '1 onion, chopped', '1 green pepper, chopped', '1 lb. ground beef', '1 can (8 oz.) tomato sauce', '2 Tbsp. sofrito sauce with tomato', '2 tsp. capers', '4 green olive s, sliced', '1/2 lb. (8 oz.) VELVEETA®, cut into 1/2-inch cubes']","['Heat oven to 350°F.', 'Heat dressing in large skillet on medium heat. Add plantains; cook 3 min. or until golden on both sides, turning after 1-1/2 min. Remove from skillet; set aside.', 'Cook bacon, onions and peppers in same skillet 8 to 10 min. or just until bacon is crisp and vegetables are crisp-tender, stirring frequently. Add ground beef; cook 5 to 7 min. or until done, stirring frequently. Drain. Add all remaining ingredients except VELVEETA; cook on low heat 5 min. or until mixture is well blended, stirring frequently.', 'Layer half each of the plantains, meat filling and VELVEETA in 8-inch square baking dish sprayed with cooking spray. Repeat layers.', 'Bake 30 min. or until heated through.']",Puerto Rican,Pastelon,"['01/24/2018, 16:48:33', '04/07/2019, 17:10:03', '11/29/2018, 23:10:55']",False
regional,Celebrate any special occasion with our Pecan Rum Cake Recipe! Get out your fluted tube pan and some pecans to make this moist and nutty rum cake recipe.,Pecan Rum Cake Recipe.jpg,"['1 cup PLANTERS Pecan Halves, coarsely chopped', '1 pkg. (2-layer size) yellow cake mix', '4 egg s', ""1 cup BREAKSTONE'S or KNUDSEN Sour Cream"", '3/4 cup dark rum, divided', '1/2 cup oil', '1/2 cup sugar', '1/4 cup (1/2 stick) butter or margarine']","['Preheat oven to 350°F. Sprinkle pecans evenly onto bottom of well-greased fluted tube pan. Place cake mix, eggs, sour cream, 1/2 cup of the rum and oil in large bowl; beat with electric mixer on medium speed 2 min. or until well blended. Pour into prepared pan.', 'Bake 1 hour or until toothpick inserted near center of cake comes out clean; cool cake 10 min. in pan on wire rack. Remove cake from pan; cool completely.', 'Place sugar, butter and 2 Tbsp. water in small saucepan; bring to boil on medium heat, stirring frequently. Gradually add remaining 1/4 cup rum, stirring until well blended. Drizzle over cake slices.']",Puerto Rican,Pecan Rum Cake Recipe,"['01/13/2018, 11:19:23', '05/21/2019, 01:51:27', '06/03/2019, 16:16:25', '07/23/2018, 01:17:37']",True
regional,"Whether you call it Asapao con Camarones or Puerto Rican Shrimp & Rice, this recipe is a quick and delicious way to please four.",Puerto Rican Shrimp & Rice (Asapao con Camarones).jpg,"['1 tsp. each: ground allspice, ground coriander and dried oregano leaves', '1 lb. large shrimp (26 to 30 count), cleaned', '1/4 cup KRAFT Zesty Italian Dressing', '1 cup chopped onions', '1 cup white rice, uncooked', '1 can (14-1/2 oz.) vegetable broth', '1/2 cup water', '1 can (14-1/2 oz.) stewed tomatoes, undrained', '1 medium green pepper, chopped (about 1 cup)', '3 slices OSCAR MAYER Smoked Ham, chopped']","['Combine seasonings in medium bowl. Add shrimp; toss to coat.', 'Heat dressing in large skillet on medium-high heat. Add shrimp; cook 5 min. or until shrimp turn pink and are browned on both sides, stirring frequently. Remove shrimp from skillet; keep warm. Add onions and rice to skillet; cook 5 min. or until onions are crisp-tender. Stir in broth and water; bring to boil. Cover; reduce heat to low. Simmer 15 min. or until rice is tender.', 'Add tomatoes with their liquid, the peppers, ham and shrimp; stir. Cover. Cook 5 to 10 min. or until heated through.']",Puerto Rican,Puerto Rican Shrimp & Rice (Asapao con Camarones),"['02/01/2018, 00:37:20', '06/09/2019, 01:59:22']",False
regional,"Need an appetizer that will get the whole party talking? Try topping fried plantain slices with sautéed shrimp, avocados and spicy mayo!",Chipotle Shrimp & Avocado Tostones.jpg,"['8 uncooked deveined peeled medium shrimp', '2 Tbsp. KRAFT Chipotle Aioli, divided', '3 Tbsp. oil, divided', '1 large green plantain, cut into 16 slices', '1 small fully ripe avocado', '1 Tbsp. fresh lime juice', ""1 Tbsp. BREAKSTONE'S or KNUDSEN Sour Cream"", '2 Tbsp. chopped fresh cilantro, divided']","['Toss shrimp with 1 Tbsp. aioli until evenly coated.', 'Heat half the oil in large skillet on medium heat. Add plantains; cook 3 to 5 min. or until lightly browned, turning once. Use slotted spoon to transfer plantains to work surface; flatten to 1/4-inch thickness. Return plantains to skillet with remaining oil; cook 3 to 5 min. or until golden brown on both sides, turning once. Remove from skillet; drain on paper towels.', 'Add shrimp to skillet; cook 4 to 6 min. or until shrimp turn pink, stirring frequently. Cool slightly. Meanwhile, mash avocado in medium bowl. Add lime juice, sour cream and 1 Tbsp. cilantro; mix well.', 'Cut shrimp lengthwise in half. Place plantain slices on serving plate; top with avocado mixture, shrimp, remaining aioli and cilantro.']",Puerto Rican,Chipotle Shrimp & Avocado Tostones,"['09/25/2018, 17:42:00']",False
