category,description,estimatedTime,imageName,ingredients,procedure,subcategory,title,times,isFavorite
dinner,"Get 13 grams of protein to go in this 5-minute, calcium-rich burrito!",5.0,Cheesy Burrito Scramble to Go.jpg,"1 whole wheat tortilla (6 inch), 1 KRAFT 2% Milk Singles, 1 egg, 1 Tbsp. salsa","1 whole wheat tortilla (6 inch), 1 KRAFT 2% Milk Singles, 1 egg, 1 Tbsp. salsa",Breakfast & Brunch Recipes,Cheesy Burrito Scramble to Go,"1 whole wheat tortilla (6 inch), 1 KRAFT 2% Milk Singles, 1 egg, 1 Tbsp. salsa",True
dinner,Delight the whole family with the delicious flavor of this Cheesy Vegetable Tortilla Bake. We bet they'll ask you to make it again!,45.0,Cheesy Vegetable Tortilla Bake.jpg,"1 Tbsp. oil, 1 pkg. (6 oz.) OSCAR MAYER Baked Cooked Ham, chopped, 1 each green and red pepper, chopped, 1 onion, chopped, 1/2 cup TACO BELL® Thick & Chunky Salsa, 6 egg s, beaten, ""3/4 cup BREAKSTONES or KNUDSEN Sour Cream"", 9 corn tortilla s (6 inch), cut in half, 1 pkg. (8 oz.) KRAFT Mexican Style Finely Shredded Four Cheese, divided","1 Tbsp. oil, 1 pkg. (6 oz.) OSCAR MAYER Baked Cooked Ham, chopped, 1 each green and red pepper, chopped, 1 onion, chopped, 1/2 cup TACO BELL® Thick & Chunky Salsa, 6 egg s, beaten, ""3/4 cup BREAKSTONES or KNUDSEN Sour Cream"", 9 corn tortilla s (6 inch), cut in half, 1 pkg. (8 oz.) KRAFT Mexican Style Finely Shredded Four Cheese, divided",Breakfast & Brunch Recipes,Cheesy Vegetable Tortilla Bake,"1 Tbsp. oil, 1 pkg. (6 oz.) OSCAR MAYER Baked Cooked Ham, chopped, 1 each green and red pepper, chopped, 1 onion, chopped, 1/2 cup TACO BELL® Thick & Chunky Salsa, 6 egg s, beaten, ""3/4 cup BREAKSTONES or KNUDSEN Sour Cream"", 9 corn tortilla s (6 inch), cut in half, 1 pkg. (8 oz.) KRAFT Mexican Style Finely Shredded Four Cheese, divided",False
dinner,"This Chilaquiles Torte truly makes a beautiful presentation at the table. And as gorgeous as it is, it tastes even better!",1.0,Chilaquiles Torte.jpg,"12 egg s, 1 cup green salsa, divided, 3/4 cup milk, 4 cups tortilla chips, 1-1/2 cups KRAFT Shredded Queso Quesadilla Cheese with a TOUCH OF PHILADELPHIA, divided, 3 green onions, chopped, divided, 1 plum tomato, seeded, chopped, ""1/2 cup BREAKSTONES or KNUDSEN Sour Cream""","12 egg s, 1 cup green salsa, divided, 3/4 cup milk, 4 cups tortilla chips, 1-1/2 cups KRAFT Shredded Queso Quesadilla Cheese with a TOUCH OF PHILADELPHIA, divided, 3 green onions, chopped, divided, 1 plum tomato, seeded, chopped, ""1/2 cup BREAKSTONES or KNUDSEN Sour Cream""",Breakfast & Brunch Recipes,Chilaquiles Torte,"12 egg s, 1 cup green salsa, divided, 3/4 cup milk, 4 cups tortilla chips, 1-1/2 cups KRAFT Shredded Queso Quesadilla Cheese with a TOUCH OF PHILADELPHIA, divided, 3 green onions, chopped, divided, 1 plum tomato, seeded, chopped, ""1/2 cup BREAKSTONES or KNUDSEN Sour Cream""",True
dinner,Classic corn bread gets a major flavor boost when it's topped with sautéed onions and poblano chiles blended with sour cream.,30.0,Corn Bread with Poblanos & Sour Cream.jpg,"1 pkg. (8.5 oz.) corn muffin mix, 1 can (11 oz.) whole kernel corn, drained, divided, 1/2 cup KRAFT Shredded Cheddar Cheese, 2 Tbsp. oil, 1/2 cup sliced onions, 4 roasted poblano chiles, peeled, seeded and thinly sliced, ""1/2 cup BREAKSTONES or KNUDSEN Sour Cream"", 1/4 cup water, 1/4 tsp. salt","1 pkg. (8.5 oz.) corn muffin mix, 1 can (11 oz.) whole kernel corn, drained, divided, 1/2 cup KRAFT Shredded Cheddar Cheese, 2 Tbsp. oil, 1/2 cup sliced onions, 4 roasted poblano chiles, peeled, seeded and thinly sliced, ""1/2 cup BREAKSTONES or KNUDSEN Sour Cream"", 1/4 cup water, 1/4 tsp. salt",Breakfast & Brunch Recipes,Corn Bread with Poblanos & Sour Cream,"1 pkg. (8.5 oz.) corn muffin mix, 1 can (11 oz.) whole kernel corn, drained, divided, 1/2 cup KRAFT Shredded Cheddar Cheese, 2 Tbsp. oil, 1/2 cup sliced onions, 4 roasted poblano chiles, peeled, seeded and thinly sliced, ""1/2 cup BREAKSTONES or KNUDSEN Sour Cream"", 1/4 cup water, 1/4 tsp. salt",False
dinner,Double down on the berry waffle deliciousness with strawberry cream cheese spread and sliced fresh strawberries.,5.0,Double Strawberry Waffle.jpg,"1 frozen waffle, toasted, 2 Tbsp. PHILADELPHIA Strawberry Cream Cheese Spread, 3 strawberries, sliced","1 frozen waffle, toasted, 2 Tbsp. PHILADELPHIA Strawberry Cream Cheese Spread, 3 strawberries, sliced",Breakfast & Brunch Recipes,Double Strawberry Waffle,"1 frozen waffle, toasted, 2 Tbsp. PHILADELPHIA Strawberry Cream Cheese Spread, 3 strawberries, sliced",False
dinner,Enjoy the flavors of the tropics with our Fabulous Tropical Fruit Salad! Sweetened sour cream topping adds the perfect finish to this tropical fruit salad.,20.0,Fabulous Tropical Fruit Salad.jpg,"4 kiwis, peeled, sliced, 3 navel oranges, peeled, sliced and cut in half, 2 mangos, peeled, cubed, 1 pineapple, cut into bite-size chunks, 2 cups seedless red grapes, ""1/2 cup BREAKSTONES Reduced Fat or KNUDSEN Light Sour Cream"", 2 Tbsp. honey, 1 tsp. orange zest","4 kiwis, peeled, sliced, 3 navel oranges, peeled, sliced and cut in half, 2 mangos, peeled, cubed, 1 pineapple, cut into bite-size chunks, 2 cups seedless red grapes, ""1/2 cup BREAKSTONES Reduced Fat or KNUDSEN Light Sour Cream"", 2 Tbsp. honey, 1 tsp. orange zest",Breakfast & Brunch Recipes,Fabulous Tropical Fruit Salad,"4 kiwis, peeled, sliced, 3 navel oranges, peeled, sliced and cut in half, 2 mangos, peeled, cubed, 1 pineapple, cut into bite-size chunks, 2 cups seedless red grapes, ""1/2 cup BREAKSTONES Reduced Fat or KNUDSEN Light Sour Cream"", 2 Tbsp. honey, 1 tsp. orange zest",False
dinner,Skip the trip to the bakery with our Glazed Lemon Sticky Buns. Glazed Lemon Sticky Buns are a cinch to make and are served nice and warm from the oven.,50.0,Glazed Lemon Sticky Buns.jpg,"1 pkg. (3 oz.) JELL-O Lemon Flavor Gelatin, 1 Tbsp. juice and 2 tsp. zest from 1 lemon, divided, 1-1/2 cups powdered sugar, divided, 2 can (8 oz. each) refrigerated crescent dinner rolls, divided, 1/4 cup butter, melted, divided, 2 oz. (1/4 of 8-oz. pkg.) PHILADELPHIA Cream Cheese, softened","1 pkg. (3 oz.) JELL-O Lemon Flavor Gelatin, 1 Tbsp. juice and 2 tsp. zest from 1 lemon, divided, 1-1/2 cups powdered sugar, divided, 2 can (8 oz. each) refrigerated crescent dinner rolls, divided, 1/4 cup butter, melted, divided, 2 oz. (1/4 of 8-oz. pkg.) PHILADELPHIA Cream Cheese, softened",Breakfast & Brunch Recipes,Glazed Lemon Sticky Buns,"1 pkg. (3 oz.) JELL-O Lemon Flavor Gelatin, 1 Tbsp. juice and 2 tsp. zest from 1 lemon, divided, 1-1/2 cups powdered sugar, divided, 2 can (8 oz. each) refrigerated crescent dinner rolls, divided, 1/4 cup butter, melted, divided, 2 oz. (1/4 of 8-oz. pkg.) PHILADELPHIA Cream Cheese, softened",False
dinner,"Enjoy some Spanish flair first thing in the morning with our Migas recipe. This version of Migas includes peppers, onions, wieners and shredded cheese.",17.0,Migas.jpg,"2 tsp. oil, 1/2 red pepper, 2 green onions, 2 OSCAR MAYER Wieners, 2 tostada shells (5 inch), coarsely broken, 4 eggs, 1/2 cup KRAFT Mexican Style Finely Shredded Four Cheese","2 tsp. oil, 1/2 red pepper, 2 green onions, 2 OSCAR MAYER Wieners, 2 tostada shells (5 inch), coarsely broken, 4 eggs, 1/2 cup KRAFT Mexican Style Finely Shredded Four Cheese",Breakfast & Brunch Recipes,Migas,"2 tsp. oil, 1/2 red pepper, 2 green onions, 2 OSCAR MAYER Wieners, 2 tostada shells (5 inch), coarsely broken, 4 eggs, 1/2 cup KRAFT Mexican Style Finely Shredded Four Cheese",False
dinner,Serve this sensational Strawberry Pancakes Recipe for a morning treat. The secret ingredient in our Strawberry Pancakes Recipe? Strawberry flavored JELL-O!,25.0,Strawberry Pancakes Recipe.jpg,"4 cups fresh strawberries, sliced, 1 pkg. (3 oz.) JELL-O Strawberry Flavor Gelatin, divided, 2 cups flour, 4 tsp. CALUMET Baking Powder, 1/4 tsp. salt, 2 eggs, 2 cups milk, 1/4 cup oil, 1/2 cup maple-flavored or pancake syrup, 1 cup thawed COOL WHIP Whipped Topping","4 cups fresh strawberries, sliced, 1 pkg. (3 oz.) JELL-O Strawberry Flavor Gelatin, divided, 2 cups flour, 4 tsp. CALUMET Baking Powder, 1/4 tsp. salt, 2 eggs, 2 cups milk, 1/4 cup oil, 1/2 cup maple-flavored or pancake syrup, 1 cup thawed COOL WHIP Whipped Topping",Breakfast & Brunch Recipes,Strawberry Pancakes Recipe,"4 cups fresh strawberries, sliced, 1 pkg. (3 oz.) JELL-O Strawberry Flavor Gelatin, divided, 2 cups flour, 4 tsp. CALUMET Baking Powder, 1/4 tsp. salt, 2 eggs, 2 cups milk, 1/4 cup oil, 1/2 cup maple-flavored or pancake syrup, 1 cup thawed COOL WHIP Whipped Topping",False
dinner,Fill your home with the sweet aroma of these Apple-Cinnamon Pancakes! Our Apple-Cinnamon Pancakes will be sure to get your family out of bed fast.,30.0,Apple-Cinnamon Pancakes.jpg,"1/2 cup (1/2 of 8-oz. tub) PHILADELPHIA Cream Cheese Spread, 1/2 cup sugar, divided, 1/2 tsp. ground cinnamon, 1-3/4 cups flour, 1 Tbsp. CALUMET Baking Powder, 1/4 tsp. salt, 2 egg s, 1 cup milk, 1/4 cup oil, 1 tsp. vanilla, 2 Golden Delicious apple s, peeled, coarsely grated, 1/2 tsp. zest and 1 Tbsp. juice from 1 lemon","1/2 cup (1/2 of 8-oz. tub) PHILADELPHIA Cream Cheese Spread, 1/2 cup sugar, divided, 1/2 tsp. ground cinnamon, 1-3/4 cups flour, 1 Tbsp. CALUMET Baking Powder, 1/4 tsp. salt, 2 egg s, 1 cup milk, 1/4 cup oil, 1 tsp. vanilla, 2 Golden Delicious apple s, peeled, coarsely grated, 1/2 tsp. zest and 1 Tbsp. juice from 1 lemon",Breakfast & Brunch Recipes,Apple-Cinnamon Pancakes,"1/2 cup (1/2 of 8-oz. tub) PHILADELPHIA Cream Cheese Spread, 1/2 cup sugar, divided, 1/2 tsp. ground cinnamon, 1-3/4 cups flour, 1 Tbsp. CALUMET Baking Powder, 1/4 tsp. salt, 2 egg s, 1 cup milk, 1/4 cup oil, 1 tsp. vanilla, 2 Golden Delicious apple s, peeled, coarsely grated, 1/2 tsp. zest and 1 Tbsp. juice from 1 lemon",False
dinner,Add a little something extra to a familiar favorite with our Banana Bread with Applesauce recipe that's sure to be extra moist for your enjoyment.,75.0,Banana Bread with Applesauce.jpg,"2 cups flour, 2 tsp. CALUMET Baking Powder, 1 tsp. ground cinnamon, 1/2 tsp. salt, 2 eggs, beaten, 1 cup mashed fully ripe bananas (about 3), 1/2 cup packed brown sugar, 1/2 cup granulated sugar, 1/2 cup applesauce, 1/2 cup chopped PLANTERS Walnuts","2 cups flour, 2 tsp. CALUMET Baking Powder, 1 tsp. ground cinnamon, 1/2 tsp. salt, 2 eggs, beaten, 1 cup mashed fully ripe bananas (about 3), 1/2 cup packed brown sugar, 1/2 cup granulated sugar, 1/2 cup applesauce, 1/2 cup chopped PLANTERS Walnuts",Breakfast & Brunch Recipes,Banana Bread with Applesauce,"2 cups flour, 2 tsp. CALUMET Baking Powder, 1 tsp. ground cinnamon, 1/2 tsp. salt, 2 eggs, beaten, 1 cup mashed fully ripe bananas (about 3), 1/2 cup packed brown sugar, 1/2 cup granulated sugar, 1/2 cup applesauce, 1/2 cup chopped PLANTERS Walnuts",False
dinner,"Caramel bits and chopped walnuts add sweet nuttiness to this quick bread. It's super moist, too, thanks to the fully ripened bananas and sour cream.",75.0,Banana-Caramel Bread.jpg,"2-1/4 cups flour, 1-1/2 tsp. CALUMET Baking Powder, 1/2 tsp. baking soda, 1/2 tsp. salt, 1/4 cup butter, softened, 1 cup sugar, 1 cup mashed fully ripe banana s (about 3), ""1 cup BREAKSTONES or KNUDSEN Sour Cream"", 2 egg s, 1 cup chopped PLANTERS Walnuts, 1 cup KRAFT Caramel Bits","2-1/4 cups flour, 1-1/2 tsp. CALUMET Baking Powder, 1/2 tsp. baking soda, 1/2 tsp. salt, 1/4 cup butter, softened, 1 cup sugar, 1 cup mashed fully ripe banana s (about 3), ""1 cup BREAKSTONES or KNUDSEN Sour Cream"", 2 egg s, 1 cup chopped PLANTERS Walnuts, 1 cup KRAFT Caramel Bits",Breakfast & Brunch Recipes,Banana-Caramel Bread,"2-1/4 cups flour, 1-1/2 tsp. CALUMET Baking Powder, 1/2 tsp. baking soda, 1/2 tsp. salt, 1/4 cup butter, softened, 1 cup sugar, 1 cup mashed fully ripe banana s (about 3), ""1 cup BREAKSTONES or KNUDSEN Sour Cream"", 2 egg s, 1 cup chopped PLANTERS Walnuts, 1 cup KRAFT Caramel Bits",False
dinner,Take dessert to the next level with our Blackberry and Pistachio Éclairs. Our Blackberry and Pistachio Éclairs include a creamy vanilla filling.,105.0,Blackberry and Pistachio Éclairs.jpg,"1 pkg. (3.4 oz.) JELL-O Pistachio Flavor Instant Pudding, 1 cup milk, 1 pkg. (8 oz.) PHILADELPHIA Cream Cheese, cubed, softened, 1-1/2 cups thawed COOL WHIP Whipped Topping, 1 cup water, 1/2 cup butter, 1 Tbsp. sugar, 1 cup flour, 5 eggs, 1/2 cup blackberries, cut in half, 1/4 cup chopped shelled pistachios","1 pkg. (3.4 oz.) JELL-O Pistachio Flavor Instant Pudding, 1 cup milk, 1 pkg. (8 oz.) PHILADELPHIA Cream Cheese, cubed, softened, 1-1/2 cups thawed COOL WHIP Whipped Topping, 1 cup water, 1/2 cup butter, 1 Tbsp. sugar, 1 cup flour, 5 eggs, 1/2 cup blackberries, cut in half, 1/4 cup chopped shelled pistachios",Breakfast & Brunch Recipes,Blackberry and Pistachio Éclairs,"1 pkg. (3.4 oz.) JELL-O Pistachio Flavor Instant Pudding, 1 cup milk, 1 pkg. (8 oz.) PHILADELPHIA Cream Cheese, cubed, softened, 1-1/2 cups thawed COOL WHIP Whipped Topping, 1 cup water, 1/2 cup butter, 1 Tbsp. sugar, 1 cup flour, 5 eggs, 1/2 cup blackberries, cut in half, 1/4 cup chopped shelled pistachios",False
dinner,"If you like cinnamony donuts, chances are excellent you'll like these Breakfast Fritters, also known as Buñuelos.",25.0,Breakfast Fritters (Buñuelos).jpg,"1/4 cup sugar, divided, 1/2 tsp. ground cinnamon, 2 egg s, 1 cup super-fine cornmeal, ""1/2 cup BAKERS ANGEL FLAKE Coconut"", 1 tsp. CALUMET Baking Powder, 1 cup oil, for frying","1/4 cup sugar, divided, 1/2 tsp. ground cinnamon, 2 egg s, 1 cup super-fine cornmeal, ""1/2 cup BAKERS ANGEL FLAKE Coconut"", 1 tsp. CALUMET Baking Powder, 1 cup oil, for frying",Breakfast & Brunch Recipes,Breakfast Fritters (Buñuelos),"1/4 cup sugar, divided, 1/2 tsp. ground cinnamon, 2 egg s, 1 cup super-fine cornmeal, ""1/2 cup BAKERS ANGEL FLAKE Coconut"", 1 tsp. CALUMET Baking Powder, 1 cup oil, for frying",False
dinner,Go the extra mile and make scones from scratch. These Cheese Scones are almost as easy to make and you can taste the difference in just one bite.,32.0,Cheese Scones.jpg,"2 cups flour, 2 tsp. CALUMET Baking Powder, 1/2 tsp. salt, 1/8 tsp. ground red pepper (cayenne), 1/3 cup cold butter, cut into 1/2-inch cubes, 1-1/2 cups KRAFT Shredded Triple Cheddar Cheese with a TOUCH OF PHILADELPHIA, 3 Tbsp. KRAFT Grated Parmesan Cheese, 2 eggs, 1/3 cup milk","2 cups flour, 2 tsp. CALUMET Baking Powder, 1/2 tsp. salt, 1/8 tsp. ground red pepper (cayenne), 1/3 cup cold butter, cut into 1/2-inch cubes, 1-1/2 cups KRAFT Shredded Triple Cheddar Cheese with a TOUCH OF PHILADELPHIA, 3 Tbsp. KRAFT Grated Parmesan Cheese, 2 eggs, 1/3 cup milk",Breakfast & Brunch Recipes,Cheese Scones,"2 cups flour, 2 tsp. CALUMET Baking Powder, 1/2 tsp. salt, 1/8 tsp. ground red pepper (cayenne), 1/3 cup cold butter, cut into 1/2-inch cubes, 1-1/2 cups KRAFT Shredded Triple Cheddar Cheese with a TOUCH OF PHILADELPHIA, 3 Tbsp. KRAFT Grated Parmesan Cheese, 2 eggs, 1/3 cup milk",True
dinner,"Cut back on coffee shop expenses with this Vanilla Chiller. It has all the sweetness you'll want thanks to a vanilla coffee, ice cream and chocolate blend.",5.0,Vanilla Chiller.jpg,"1 cup brewed MAXWELL HOUSE Vanilla Flavored Coffee, chilled, 4 triangles (1/3 of 3.52-oz bar) TOBLERONE Swiss Dark or Milk Chocolate with Honey and Almond Nougat, coarsely chopped, 2 cups vanilla ice cream, softened, 6 Tbsp. thawed COOL WHIP Whipped Topping, ""3/4 tsp. grated BAKERS Semi-Sweet Chocolate""","1 cup brewed MAXWELL HOUSE Vanilla Flavored Coffee, chilled, 4 triangles (1/3 of 3.52-oz bar) TOBLERONE Swiss Dark or Milk Chocolate with Honey and Almond Nougat, coarsely chopped, 2 cups vanilla ice cream, softened, 6 Tbsp. thawed COOL WHIP Whipped Topping, ""3/4 tsp. grated BAKERS Semi-Sweet Chocolate""",Drinks,Vanilla Chiller,"1 cup brewed MAXWELL HOUSE Vanilla Flavored Coffee, chilled, 4 triangles (1/3 of 3.52-oz bar) TOBLERONE Swiss Dark or Milk Chocolate with Honey and Almond Nougat, coarsely chopped, 2 cups vanilla ice cream, softened, 6 Tbsp. thawed COOL WHIP Whipped Topping, ""3/4 tsp. grated BAKERS Semi-Sweet Chocolate""",False
dinner,Relax and quench your thirst with the delicious Watermelon Agua Fresca. This refreshing beverage is great during the peak of summer or all year round.,5.0,Watermelon Agua Fresca.jpg,"1-1/2 cups water, 1/4 cup fresh lime juice, 1 pkt. CRYSTAL LIGHT PURE On The Go Lemonade Flavor Drink Mix, 5 cups seedless watermelon cubes (1 inch)","1-1/2 cups water, 1/4 cup fresh lime juice, 1 pkt. CRYSTAL LIGHT PURE On The Go Lemonade Flavor Drink Mix, 5 cups seedless watermelon cubes (1 inch)",Drinks,Watermelon Agua Fresca,"1-1/2 cups water, 1/4 cup fresh lime juice, 1 pkt. CRYSTAL LIGHT PURE On The Go Lemonade Flavor Drink Mix, 5 cups seedless watermelon cubes (1 inch)",False
dinner,"Harness mango, pineapple & orange flavors to make this Hawaiian-style pineapple smoothie. This Orange-Mango-Pineapple Smoothie is goodness in a glass.",5.0,Orange-Mango-Pineapple Smoothie.jpg,"3 cups pineapple-orange juice, 3 cups frozen chopped mangos, 1 pkg. (1 oz.) JELL-O Vanilla Flavor Sugar Free Fat Free Instant Pudding","3 cups pineapple-orange juice, 3 cups frozen chopped mangos, 1 pkg. (1 oz.) JELL-O Vanilla Flavor Sugar Free Fat Free Instant Pudding",Drinks,Orange-Mango-Pineapple Smoothie,"3 cups pineapple-orange juice, 3 cups frozen chopped mangos, 1 pkg. (1 oz.) JELL-O Vanilla Flavor Sugar Free Fat Free Instant Pudding",False
dinner,Strawberry-flavored lemonade drink mix is dissolved in cranberry-apple drink and blended with club soda for a fruity and fizzy summer drink.,5.0,Patio Fizz.jpg,"3 cups cold cranberry-apple drink, 1/4 cup COUNTRY TIME Strawberry Lemonade Drink Mix, 1 cup cold club soda","3 cups cold cranberry-apple drink, 1/4 cup COUNTRY TIME Strawberry Lemonade Drink Mix, 1 cup cold club soda",Drinks,Patio Fizz,"3 cups cold cranberry-apple drink, 1/4 cup COUNTRY TIME Strawberry Lemonade Drink Mix, 1 cup cold club soda",False
dinner,"Frozen mixed berries and cottage cheese are what make these smoothies super: super thick, super creamy and super delicious!",5.0,Super Smoothie.jpg,"1 cup fat-free milk, ""1 cup BREAKSTONES or KNUDSEN 2% Milkfat Low Fat Cottage Cheese"", 1 cup frozen mixed berries (blackberries, blueberries, raspberries, strawberries), 1 stick CRYSTAL LIGHT On The Go Energy Wild Strawberry Flavor Drink Mix","1 cup fat-free milk, ""1 cup BREAKSTONES or KNUDSEN 2% Milkfat Low Fat Cottage Cheese"", 1 cup frozen mixed berries (blackberries, blueberries, raspberries, strawberries), 1 stick CRYSTAL LIGHT On The Go Energy Wild Strawberry Flavor Drink Mix",Drinks,Super Smoothie,"1 cup fat-free milk, ""1 cup BREAKSTONES or KNUDSEN 2% Milkfat Low Fat Cottage Cheese"", 1 cup frozen mixed berries (blackberries, blueberries, raspberries, strawberries), 1 stick CRYSTAL LIGHT On The Go Energy Wild Strawberry Flavor Drink Mix",False
dinner,Chill out in the heat without having to worry about the little ones making a mess with No-Drip Strawberry Ice Pops. No-Drip Strawberry Ice Pops are served in small paper cups so the awesome strawberry flavor stays exactly where it should! Great taste. No mess. Perfect!,130.0,No-Drip Strawberry Ice Pops.jpg,"2 cups boiling water, 1 pkg. (3 oz.) JELL-O Strawberry Flavor Gelatin, 18 fresh strawberries, stemmed, 2/3 cup (filled to 2-qt. line) KOOL-AID Strawberry Flavor Sugar-Sweetened Drink Mix, or any red flavor","2 cups boiling water, 1 pkg. (3 oz.) JELL-O Strawberry Flavor Gelatin, 18 fresh strawberries, stemmed, 2/3 cup (filled to 2-qt. line) KOOL-AID Strawberry Flavor Sugar-Sweetened Drink Mix, or any red flavor",Drinks,No-Drip Strawberry Ice Pops,"2 cups boiling water, 1 pkg. (3 oz.) JELL-O Strawberry Flavor Gelatin, 18 fresh strawberries, stemmed, 2/3 cup (filled to 2-qt. line) KOOL-AID Strawberry Flavor Sugar-Sweetened Drink Mix, or any red flavor",False
dinner,Use a different KOOL-AID flavor every time you make this classic summertime treat.,10.0,KOOL-AID Float.jpg,"1 cup granular no-calorie sweetener, 1 env. KOOL-AID Cherry Flavor Unsweetened Drink Mix, or any other flavor, 1 qt. (4 cups) cold water, 2 cups cold light white grape juice cocktail, 2 cups cold seltzer, 1 pt. (2 cups) no-sugar-added light vanilla ice cream","1 cup granular no-calorie sweetener, 1 env. KOOL-AID Cherry Flavor Unsweetened Drink Mix, or any other flavor, 1 qt. (4 cups) cold water, 2 cups cold light white grape juice cocktail, 2 cups cold seltzer, 1 pt. (2 cups) no-sugar-added light vanilla ice cream",Drinks,KOOL-AID Float,"1 cup granular no-calorie sweetener, 1 env. KOOL-AID Cherry Flavor Unsweetened Drink Mix, or any other flavor, 1 qt. (4 cups) cold water, 2 cups cold light white grape juice cocktail, 2 cups cold seltzer, 1 pt. (2 cups) no-sugar-added light vanilla ice cream",True
dinner,This glorious hot chocolate gets its peppermint flavor straight from a finely crushed candy cane. Add a dollop of whipped topping and enjoy!,5.0,Peppermint Hot Chocolate.jpg,"1 Tbsp. finely crushed candy cane, 1 T DISC TASSIMO SUCHARD Hot Chocolate, 1 Tbsp. thawed COOL WHIP Whipped Topping","1 Tbsp. finely crushed candy cane, 1 T DISC TASSIMO SUCHARD Hot Chocolate, 1 Tbsp. thawed COOL WHIP Whipped Topping",Drinks,Peppermint Hot Chocolate,"1 Tbsp. finely crushed candy cane, 1 T DISC TASSIMO SUCHARD Hot Chocolate, 1 Tbsp. thawed COOL WHIP Whipped Topping",False
dinner,Try a delicious new morning drink with our Cinnamon-Caramel Iced Coffee Recipe. This iced coffee recipe should definitely be on your must-make list!,40.0,Cinnamon-Caramel Iced Coffee Recipe.jpg,"6 Tbsp. MAXWELL HOUSE Coffee, 1/2 tsp. ground cinnamon, 1/2 cup caramel ice cream topping, 4-1/2 cups cold water, ice cubes","6 Tbsp. MAXWELL HOUSE Coffee, 1/2 tsp. ground cinnamon, 1/2 cup caramel ice cream topping, 4-1/2 cups cold water, ice cubes",Drinks,Cinnamon-Caramel Iced Coffee Recipe,"6 Tbsp. MAXWELL HOUSE Coffee, 1/2 tsp. ground cinnamon, 1/2 cup caramel ice cream topping, 4-1/2 cups cold water, ice cubes",False
dinner,"This delish, fruit-studded dessert might look like a glass of sangria—but dip a spoon in, and you'll find fruity, boozy JELL-O Gelatin.",260.0,Sangria Party Cups.jpg,"1-1/2 cups boiling water, 1 pkg. (3 oz.) JELL-O Strawberry Flavor Gelatin, 1 pkg. (3 oz.) JELL-O Lemon Flavor Gelatin, ice cubes, 1 cup dry red wine, 8 fresh strawberries, quartered, 1 can (11 oz.) mandarin oranges, drained, 1 cup seedless red grapes, halved","1-1/2 cups boiling water, 1 pkg. (3 oz.) JELL-O Strawberry Flavor Gelatin, 1 pkg. (3 oz.) JELL-O Lemon Flavor Gelatin, ice cubes, 1 cup dry red wine, 8 fresh strawberries, quartered, 1 can (11 oz.) mandarin oranges, drained, 1 cup seedless red grapes, halved",Drinks,Sangria Party Cups,"1-1/2 cups boiling water, 1 pkg. (3 oz.) JELL-O Strawberry Flavor Gelatin, 1 pkg. (3 oz.) JELL-O Lemon Flavor Gelatin, ice cubes, 1 cup dry red wine, 8 fresh strawberries, quartered, 1 can (11 oz.) mandarin oranges, drained, 1 cup seedless red grapes, halved",False
dinner,"You've heard of putting oatmeal into smoothies for thicker, creamier texture. It works with quinoa, too! Try it in these luscious strawberry shakes.",15.0,Strawberry Swirl Shake.jpg,"3 cups water, 1 pkg. (0.14 oz.) KOOL-AID Strawberry Flavor Unsweetened Drink Mix, 1 cup sugar, 2 cups cooked quinoa, cooled, 2 cups strawberries, 1 cup ice cubes","3 cups water, 1 pkg. (0.14 oz.) KOOL-AID Strawberry Flavor Unsweetened Drink Mix, 1 cup sugar, 2 cups cooked quinoa, cooled, 2 cups strawberries, 1 cup ice cubes",Drinks,Strawberry Swirl Shake,"3 cups water, 1 pkg. (0.14 oz.) KOOL-AID Strawberry Flavor Unsweetened Drink Mix, 1 cup sugar, 2 cups cooked quinoa, cooled, 2 cups strawberries, 1 cup ice cubes",True
dinner,Kick the day off with our Chocolate-Hazelnut Iced Latte Recipe. Or prepare this iced latte recipe later in the day when you want a moment of tranquility.,2.0,Chocolate-Hazelnut Iced Latte Recipe.jpg,"1 stick MAXWELL HOUSE INTERNATIONAL Iced Hazelnut Latte, 8 oz. cold milk, 1 Tbsp. chocolate syrup, 1/4 tsp. sugar, ice","1 stick MAXWELL HOUSE INTERNATIONAL Iced Hazelnut Latte, 8 oz. cold milk, 1 Tbsp. chocolate syrup, 1/4 tsp. sugar, ice",Drinks,Chocolate-Hazelnut Iced Latte Recipe,"1 stick MAXWELL HOUSE INTERNATIONAL Iced Hazelnut Latte, 8 oz. cold milk, 1 Tbsp. chocolate syrup, 1/4 tsp. sugar, ice",False
dinner,"Looking to jazz up your java? Then this delish coffee drink, flavored with orange zest and brandy, should be on your to-make list.",10.0,Coffee Cordial.jpg,"1/2 cup MAXWELL HOUSE Instant Coffee, 1/4 cup sugar, 1 qt. (4 cups) boiling water, 1/4 cup brandy, 12 strips orange zest","1/2 cup MAXWELL HOUSE Instant Coffee, 1/4 cup sugar, 1 qt. (4 cups) boiling water, 1/4 cup brandy, 12 strips orange zest",Drinks,Coffee Cordial,"1/2 cup MAXWELL HOUSE Instant Coffee, 1/4 cup sugar, 1 qt. (4 cups) boiling water, 1/4 cup brandy, 12 strips orange zest",False
dinner,Warm up winter nights with our Creamy Eggnog Coffee Recipe. This eggnog coffee recipe will make your toasty drink not only refreshing but festive as well.,10.0,Creamy Eggnog Coffee.jpg,"3 cups fresh brewed GEVALIA ROYAL VINTER SPICE coffee, 3 cups eggnog, warmed","3 cups fresh brewed GEVALIA ROYAL VINTER SPICE coffee, 3 cups eggnog, warmed",Drinks,Creamy Eggnog Coffee,"3 cups fresh brewed GEVALIA ROYAL VINTER SPICE coffee, 3 cups eggnog, warmed",False
