category,description,imageName,ingredients,procedure,subcategory,title,times,isFavorite
regional,Try our Sausage Po' Boy Recipe when you need a quick dish sure to impress. Our Sausage Po' Boy Recipe includes a crusty baguette and Cajun-spiced mayo.,Sausage Po' Boy Recipe.jpg,"['1 pkg. (13 oz.) OSCAR MAYER Natural Uncured Roasted Peppers & Onions Sausage', '1/3 cup KRAFT Mayo with Olive Oil Reduced Fat Mayonnaise', '1 tsp. Cajun seasoning', '1 French bread baguette (10 oz.), cut into 6 pieces', '2 plum tomatoes, each cut into 6 slices', '3 cups loosely packed shredded romaine lettuce']","['Cut sausage lengthwise in half; cook in large nonstick skillet on medium heat 7 to 9 min. or until evenly browned, turning occasionally.', 'Mix mayo and Cajun seasoning; spread onto cut sides of bread.', 'Cut each sausage piece crosswise into 6 slices; fill bread with sausage, tomatoes and lettuce.']",Cajun Recipes,Sausage Po' Boy Recipe,"['01/30/2018, 20:25:27', '02/28/2019, 18:36:05', '12/12/2018, 13:47:05']",False
regional,"Give your French fries some zip with Seasoned Ketchup. Our Seasoned Ketchup recipe features Cajun seasoning, chipotle chile pepper powder and sweet relish.",Seasoned Ketchup.jpg,"['1 cup HEINZ Tomato Ketchup', '1 Tbsp. HEINZ Sweet Relish', '1/2 tsp. chipotle chile pepper powder', '1/2 tsp. Cajun seasoning']",['Mix ingredients until blended.'],Cajun Recipes,Seasoned Ketchup,"['03/19/2018, 10:54:39']",True
regional,"Give your cooking some Creole flavor with our Slow-Cooker Cheesy Jambalaya Dip. Our Slow-Cooker Cheesy Jambalaya Dip recipe includes red and green peppers, andouille sausage and zesty Cajun seasoning.",Slow-Cooker Cheesy Jambalaya Dip.jpg,"['1/2 lb. (8 oz.) VELVEETA, cut into 1/2-inch cubes', ""1/2 cup BREAKSTONE'S or KNUDSEN Sour Cream"", '6 oz. andouille sausage, chopped', '1/2 cup each chopped green and red peppers', '1/2 cup chopped onions', '1 plum tomato, chopped', '2 tsp. Cajun seasoning']","['Combine ingredients in slow cooker sprayed with cooking spray.', 'Cook on LOW 2 to 3 hours (or on HIGH 1 to 1-1/2 hours), stirring every 30 min.']",Cajun Recipes,Slow-Cooker Cheesy Jambalaya Dip,"['02/25/2018, 00:32:14', '07/22/2018, 18:43:05', '08/05/2018, 02:58:39', '10/11/2018, 20:15:18']",True
regional,Add some Southern comfort to the table with our VELVEETA® Easy Creamy Grits Recipe. Our VELVEETA® Easy Creamy Grits Recipe is a great dish any time of day.,VELVEETA® Easy Creamy Grits Recipe.jpg,"['1 qt. (4 cups) water', '1 cup quick-cooking grits', '2 Tbsp. butter', '2 cloves garlic, minced', '1/4 tsp. Cajun seasoning', '2 eggs', '1/2 lb. (8 oz.) VELVEETA, cut into 1/2-inch cubes']","['Heat oven to 350°F.', 'Bring water to boil in medium saucepan on medium-high heat. Gradually stir in grits; cook on low heat 5 min., stirring occasionally. Remove from heat. Add butter, garlic and seasoning; stir until butter is completely melted and mixture is well blended.', 'Beat eggs in small bowl until blended. Add small amount of hot grits; mix well. Gradually add to remaining grits in pan, stirring constantly until blended.', 'Pour into 8-inch square baking dish sprayed with cooking spray. Top with VELVEETA; press gently into grits with back of spoon until partially covered.', 'Bake 40 min. Let stand 10 min. before serving.']",Cajun Recipes,VELVEETA® Easy Creamy Grits Recipe,"['09/06/2018, 17:27:00']",False
regional,It's always a good time when there are shrimp and pasta in the skillet. This recipe spices up the fun with Mexican chorizo and crushed red pepper.,Spicy Shrimp Pasta Skillet.jpg,"['1/4 cup KRAFT Zesty Italian Dressing, divided', '1 cup chopped onion s', '7-1/2 oz. (1/2 of 15-oz. pkg) Mexican chorizo, sliced into 1-inch pieces', '1 can (14 oz.) artichoke hearts, drained, chopped', '1/2 tsp. crushed red pepper', '4 plum tomatoes, chopped', '1 cup chicken broth', '1 lb. uncooked shrimp, peeled, deveined', '8 oz. spaghetti, uncooked', '1 cup KRAFT Shredded Mozzarella Cheese', '1 Tbsp. chopped fresh parsley']","['Heat 1 Tbsp. of the dressing in large skillet on medium-high heat. Add onions and chorizo; cook 10 min. to brown chorizo, stirring occasionally. Add remaining 3 Tbsp. dressing, artichokes and red pepper; bring to boil. Reduce heat to low; simmer 7 to 10 min. or until chorizo is cooked through.', 'Add tomatoes, chicken broth and shrimp; cover. Cook 5 to 8 min. or until shrimp is pink and vegetables are heated through.', 'Meanwhile, cook pasta as directed on package; drain. Toss pasta with meat mixture and cheese; sprinkle with parsley. Serve immediately.']",Cajun Recipes,Spicy Shrimp Pasta Skillet,"['08/02/2018, 19:38:59']",False
regional,"Enjoy the spicy Cajun taste of our Crab Boil Recipe. Our delicious Crab Boil Recipe includes corn, potatoes, onions and shrimp, all seasoned to perfection.",Crab Boil Recipe.jpg,"['1 pkg. (1 oz.) TACO BELL® Taco Seasoning Mix', '1 Tbsp. roasted ground cumin', '2 tsp. ground red pepper (cayenne)', '1/4 cup HEINZ Apple Cider Vinegar', '3 ears corn on the cob, husks and silk removed', '1-1/2 lb. mixed red and white new potatoes, cut in half', '3 onions, quartered', '6 cloves garlic, peeled', '3 lb. crab legs', '2 lb. uncooked deveined large shrimp with shells and tails left on', '3 Tbsp. HEINZ Zesty Cocktail Sauce', '3 lemons, each cut into 4 wedges']","['Fill stockpot halfway with water; bring to boil. Add taco seasoning mix, cumin and red pepper; stir until blended. Stir in vinegar.', 'Cut each ear of corn into 3 pieces. Add to stockpot along with the potatoes, onions and garlic; stir. Cook on medium heat 10 min.', 'Add crab legs and shrimp; stir. Cook 10 to 12 min. or until shrimp turn pink, stirring occasionally. Drain.', 'Serve seafood and vegetables with cocktail sauce and lemon wedges.']",Cajun Recipes,Crab Boil Recipe,"['05/11/2019, 23:18:38', '08/22/2019, 00:42:30', '09/18/2019, 01:02:44', '09/27/2019, 11:18:41']",False
regional,"Make the meal simple and scrumptious with this Easy Seafood Gumbo entrée. Perfect for potlucks, family gatherings and other occasions, this Easy Seafood Gumbo is a must-have in your recipe collection.",Easy Seafood Gumbo.jpg,"['1/4 cup butter', '1/4 cup flour', '1/2 cup each chopped celery, green peppers and onions', '3 cloves garlic, minced', '6-1/2 oz. (1/2 of 13-oz. pkg.) OSCAR MAYER Natural Uncured Turkey Sausage, sliced', '1 can (14-1/2 oz.) diced tomatoes, drained', '1 can (14-1/2 oz.) fat-free reduced-sodium chicken broth', '2 tsp. LEA & PERRINS Worcestershire Sauce', '1/2 tsp. Cajun seasoning', '1 lb. uncooked deveined peeled medium shrimp', '3 cups hot cooked long-grain white rice']","['Melt butter in Dutch oven on medium heat. Stir in flour; cook 5 to 6 min. or until golden brown, stirring constantly. Add celery, green peppers and onions; cook 2 to 3 min. or until crisp-tender, stirring frequently.', 'Add sausage, tomatoes, chicken broth, Worcestershire sauce and Cajun seasoning; stir until blended. Bring to boil; cover. Simmer on medium-low heat 5 min., stirring occasionally.', 'Stir in shrimp; cook 4 to 5 min. or just until tender, stirring frequently.', 'Serve over rice.']",Cajun Recipes,Easy Seafood Gumbo,"['03/31/2019, 18:39:39', '07/04/2018, 18:13:37', '07/26/2019, 05:52:07', '10/31/2018, 22:07:57']",False
regional,"Cook up something Cajun today using our Spicy Grilled Tilapia with Garden Remoulade recipe. Top freshly grilled filets with a spicy, creamy, tasty blend.",Spicy Grilled Tilapia with Garden Remoulade.jpg,"['1/4 cup oil', '1 Tbsp. Creole seasoning', '1 Tbsp. hot pepper sauce', '8 tilapia fillets (2 lb.)', '1/2 cup chopped tomato es', '1/2 cup chopped cucumber s', '1/4 cup finely chopped red onion s', '2 Tbsp. chopped fresh parsley', '1/3 cup KRAFT Mayo Chipotle Flavored Reduced Fat Mayonnaise', ""1/4 cup BREAKSTONE'S or KNUDSEN Sour Cream""]","['Mix oil, seasoning and hot sauce; pour over fish in shallow dish. Turn to evenly coat. Refrigerate 30 min. to marinate.', 'Meanwhile, combine tomatoes, cucumbers, onions and parsley in medium bowl. Mix mayo and sour cream until blended. Add to vegetable mixture; mix lightly. Refrigerate until ready to serve.', 'Heat greased grill to medium-high heat. Remove fish from marinade; discard marinade. Grill fish 3 min. on each side or until fish flakes easily with fork. Serve with mayo mixture.']",Cajun Recipes,Spicy Grilled Tilapia with Garden Remoulade,"['05/18/2019, 02:59:45', '08/07/2019, 11:15:18']",False
regional,Don't head to a restaurant to get tender and crispy curried shrimp. Make it at home with this Coconut-Curried Shrimp with Chutney Mayo recipe.,Coconut-Curried Shrimp with Chutney Mayo.jpg,"['1/4 cup KRAFT Light Mayo Reduced Fat Mayonnaise', '1/4 cup chutney', '1/4 tsp. vanilla', '1/2 tsp. curry powder, divided', ""1/2 cup BAKER'S ANGEL FLAKE Coconut"", '1/4 cup flour', '1 egg', '1 Tbsp. water', '3/4 lb. uncooked deveined peeled medium shrimp', '1-1/2 cups PLANTERS Peanut Oil']","['Mix mayo, chutney, vanilla and 1/4 tsp. curry powder until blended.', 'Mix coconut, flour and remaining curry powder in shallow pan. Whisk egg and water in medium bowl until blended. Dip shrimp, 1 at a time, into egg mixture; shake off excess. Coat with flour mixture.', 'Heat oil in large saucepan on medium heat. Add shrimp, in batches; cook 2 min. or until golden brown. Remove from pan with slotted spoon; drain. Serve with chutney mayo.']",Caribbean Recipes,Coconut-Curried Shrimp with Chutney Mayo,"['02/25/2019, 02:34:38', '03/15/2018, 00:44:07', '06/24/2018, 11:55:39', '11/26/2018, 23:51:14']",False
regional,Dress up your typical steak recipe with this Flank Steak with Salsa! The black bean salsa in this Flank Steak with Salsa gives it a unique take.,Flank Steak with Black Bean Salsa.jpg,"['1/2 cup KRAFT Zesty Italian Dressing', 'juice from 2 limes, divided', '2 beef flank steaks (3 lb.)', '1/4 cup KRAFT Barbecue Sauce, any flavor', '1 can (15 oz.) black beans, rinsed', '1 pound red pepper, chopped', '4 slices OSCAR MAYER Baked Cooked Ham, finely chopped', '1 serrano chile, seeded, chopped', '1/4 cup finely chopped fresh cilantro']","['Mix dressing and half the lime juice. Pour over meat in shallow dish; turn to coat both sides of each steak. Refrigerate 30 min. to marinate.', 'Meanwhile, mix remaining lime juice and barbecue sauce in medium bowl. Stir in all remaining ingredients.', 'Heat grill to medium heat. Remove meat from marinade; discard marinade. Grill steak 17 to 21 min. or until medium doneness (160ºF), turning occasionally. Transfer to cutting board. Let stand 5 min. Cut steak across the grain into thin slices. Serve with bean salsa.']",Caribbean Recipes,Flank Steak with Black Bean Salsa,"['01/13/2019, 23:01:25', '08/19/2019, 05:35:39']",False
regional,Explore the sweet side of plantains with our Fried Plantains Recipe. Our tasty Fried Plantains Recipe includes a sweet sour cream sauce with spices.,Fried Plantains Recipe.jpg,"['2 Tbsp. butter, divided', '1 lb. very ripe plantain s, sliced (about 2 plantains)', ""1/4 cup BREAKSTONE'S or KNUDSEN Sour Cream"", '1/4 cup thawed COOL WHIP Whipped Topping', '2 tsp. brown sugar', '1/4 tsp. ground cinnamon']","['Melt 1 Tbsp. of the butter in medium skillet on medium heat. Cook half of the plantains 3 min. on each side or until golden brown on both sides. Remove from skillet; set aside and keep warm. Repeat with remaining 1 Tbsp. butter and plantains.', 'Combine sour cream, whipped topping, sugar and cinnamon in small bowl. Serve plantains with sweet cream sauce.']",Caribbean Recipes,Fried Plantains Recipe,"['04/22/2018, 08:25:25']",False
regional,"Toss boring fruit salad recipes aside and surprise them with this scrumptious Grilled Fruit Salad! Papaya, banana, mango and pineapple meet a creamy sour cream mixture in this Grilled Fruit Salad recipe.",Grilled Fruit Salad.jpg,"[""1/2 cup BREAKSTONE'S Reduced Fat or KNUDSEN Light Sour Cream"", '1 Tbsp. KOOL-AID Orange Flavor Sugar-Sweetened Drink Mix', '1/4 tsp. ground red pepper (cayenne)', '1 pineapple, peeled, cored and cut into wedges', '1 mango, peeled, pitted and cut into wedges', '1 papaya, peeled, seeded and cut into wedges', '2 banana s, diagonally sliced']","['Heat greased grill to medium-high heat.', 'Combine first 3 ingredients until well blended. Refrigerate until ready to use.', 'Grill fruit 6 min. or until lightly browned on both sides, turning over after 3 min.', 'Arrange fruit on platter. Serve immediately with sour cream mixture. Or, cover and refrigerate fruit platter and sour cream mixture separately until ready to serve. Spoon sour cream mixture over fruit just before serving.']",Caribbean Recipes,Grilled Fruit Salad,"['09/12/2019, 03:01:31']",False
regional,Tropical flavors like pineapple and coconut are what give this luscious dessert dip its name. Break out the cream cheese and prepare to wow the crowd.,Layered Island Dip.jpg,"['1 pkg. (8 oz.) PHILADELPHIA Cream Cheese, softened, divided', '1 can (8 oz.) crushed pineapple, drained', '2 cups thawed COOL WHIP Whipped Topping, divided', '2 Tbsp. powdered sugar', '1 Tbsp. lime zest', '2 tsp. rum', '1/2 cup chopped PLANTERS Macadamias', ""1/2 cup BAKER'S ANGEL FLAKE Coconut, toasted"", '1 kiwi, chopped', '2 or 3 mint leaves']","['Beat 4 oz. cream cheese, pineapple and 1 cup COOL WHIP with whisk until well blended; spread onto bottom of pie plate. Mix remaining cream cheese, powdered sugar and lime zest; spread over pineapple layer.', 'Mix remaining COOL WHIP and rum; spread over lime layer. Refrigerate at least 1 hour before serving.', 'Top with nuts, coconut, kiwi and mint. Serve with NILLA Wafers.']",Caribbean Recipes,Layered Island Dip,"['01/08/2018, 17:45:52']",False
regional,This refreshing punch is what happens when you combine the taste of the Caribbean with good old-fashioned lemonade.,Caribbean Cooler.jpg,"['COUNTRY TIME Lemonade Flavor Drink Mix', '3 cups cold water', '2 cups cold pineapple juice', '1 cup cream of coconut']","['Measure drink mix into cap to 2-qt. line; empty into large plastic or glass pitcher. Add water; stir until mix is dissolved.', 'Stir in remaining ingredients. Refrigerate until ready to serve.', 'Serve over crushed ice.']",Caribbean Recipes,Caribbean Cooler,"['01/17/2019, 09:18:35', '03/17/2019, 08:37:27']",False
regional,"Enjoy our Key Lime Margarita Pie, but don't worry about alcohol! This Key Lime Margarita Pie's taste is from a salty pretzel crust and citrusy filling.",Key Lime Margarita Pie.jpg,"['1-1/4 cups finely crushed pretzels', '1/4 cup sugar', '6 Tbsp. butter, melted', '1 can (14 oz.) sweetened condensed milk', '1/2 cup lime juice', '1 env. (0.13 oz.) KOOL-AID Lemon-Lime Flavor Unsweetened Drink Mix', '1 tub (8 oz.) COOL WHIP Whipped Topping, thawed, divided']","['Combine pretzel crumbs, sugar and butter; press onto bottom and up side of 9-inch pie plate. Refrigerate until ready to use.', 'Whisk next 3 ingredients in large bowl until blended. Stir in 2-1/2 cups COOL WHIP; pour into crust.', 'Freeze 6 hours or until firm. Let stand at room temperature 15 min. before serving to soften slightly. Top with remaining COOL WHIP.']",Caribbean Recipes,Key Lime Margarita Pie,"['01/03/2018, 15:45:03']",False
regional,Add some heat to your day with succulent Jerk Chicken. The Caribbean-inspired marinade for Jerk Chicken is flavored with cinnamon and ground red pepper.,Jerk Chicken.jpg,"['1 env. GOOD SEASONS Italian Dressing Mix', '2 Tbsp. firmly packed brown sugar', '2 Tbsp. oil', '2 Tbsp. lite soy sauce', '1 tsp. ground cinnamon', '1 tsp. ground thyme', '1 broiler-fryer chicken (2-1/2 lb.), cut up']","['Mix all ingredients except chicken in large shallow dish until well blended.', 'Add chicken; turn over to evenly coat both sides. Cover and refrigerate 1 hour to marinate. Drain; discard marinade.', 'Preheat greased grill to medium heat. Grill chicken 40 to 45 minutes or until cooked through, turning frequently.']",Caribbean Recipes,Jerk Chicken,"['09/07/2018, 13:46:12']",True
regional,Get great flavor with our Stuffed Plantains recipe. Tasty beef and tomato filling gets topped with bacon and cheese when you make our Stuffed Plantains.,Stuffed Plantains.jpg,"['3 ripe yellow plantains, unpeeled', '1/2 cup chopped onions', '3 cloves garlic, minced', '2 Tbsp. KRAFT Zesty Italian Dressing', '1 lb. ground beef', '2 tsp. dried oregano leaves', '1 can (14-1/2 oz.) diced tomatoes, undrained', '1-1/2 cups KRAFT Shredded Cheddar Cheese, divided', '4 slices OSCAR MAYER Bacon, cooked, crumbled']","['Heat oven to 375°F.', 'Place plantains in 13x9-inch baking dish. Bake 20 min. Cool. Cut plantains lengthwise in half. Starting at one end of each, slide thumb between peel and plantain, then gently lift plantain to loosen from peel. (Do not remove plantains from peels.) Return plantain halves, cut-sides up, to baking dish.', 'Meanwhile, cook onions and garlic in dressing in large saucepan on medium-high heat 3 min. Add meat and oregano; cook 10 min. or until meat is done, stirring frequently. Add tomatoes and 3/4 cup cheese; simmer on medium-low heat 5 min. or until mixture is heated through and cheese is melted, stirring occasionally. Spoon over plantains.', 'Top with bacon and remaining cheese. Bake 5 min. or until cheese is melted.']",Caribbean Recipes,Stuffed Plantains,"['09/04/2019, 00:19:20']",False
regional,"Take a walk on the exotic side with a luscious cheesecake topped with an extravaganza of fruit—including kiwi, chopped mango and toasted coconut flakes.",Tropical Cheesecake.jpg,"['1 pkg. (8 oz.) PHILADELPHIA Cream Cheese, softened', '1/3 cup sugar', '1 tub (8 oz.) COOL WHIP Whipped Topping, thawed', '2 kiwi s, peeled, quartered, sliced and divided', '1 medium mango, peeled, chopped and divided', ""1 cup BAKER'S ANGEL FLAKE Coconut, toasted, divided"", '1 ready-to-use graham cracker crumb crust (6 oz.)']","['Beat cream cheese and sugar in large bowl with wire whisk or electric mixer until well blended.', 'Add whipped topping; stir gently until well blended. Reserve 1/4 cup each kiwi, mango and coconut for garnish. Stir remaining kiwi, mango and coconut into cream cheese mixture. Spoon into crust.', 'Refrigerate 3 hours or until set. Top with reserved mango, kiwi and coconut. Store leftover cheesecake in refrigerator.']",Caribbean Recipes,Tropical Cheesecake,"['03/02/2019, 03:15:34', '10/12/2019, 04:33:50']",True
regional,All great cooks have a secret or two. Like using Ritz Crackers to add a buttery flavor to crab cakes—and a touch of cayenne to give them just the right amount of zing.,Crab Cakes.jpg,"['1 egg', '1/4 cup KRAFT Classic Ranch Dressing', '2 cans (6 oz. each) crabmeat, drained, flaked', '20 RITZ Crackers, coarsely crushed (about 1 cup)', '1/3 cup KRAFT Shredded Parmesan, Romano, and Asiago Cheeses', '2 green onions, sliced', '1/4 tsp. ground red pepper (cayenne)']","['Heat oven to 375°F.', 'Whisk egg and dressing in large bowl until well blended. Add crabmeat; mix well. Gently stir in remaining ingredients. Let stand 3 min.', 'Shape into 24 cakes, using about 1 Tbsp. crabmeat mixture for each. Place in single layer on baking sheet sprayed with cooking spray.', 'Bake 5 to 7 min. on each side or until heated through and golden brown on both sides.']",Caribbean Recipes,Crab Cakes,"['11/08/2018, 09:18:16']",False
regional,Can't make it over to your favorite tropical island? That's OK. You can still savor sweet and savory fish fillets in your own little corner of the world.,Island Citrus Fish.jpg,"['1/4 cup packed brown sugar', '1 tsp. ground cumin', '6 cod fillet s (1-1/2 lb.)', '1/4 cup KRAFT Lite Zesty Italian Dressing', '1/4 cup lime juice', '1/2 cup orange juice', '1/4 cup chopped fresh cilantro', '2 Tbsp. chopped mint leaves']","['Heat dressing in large skillet on medium-high heat. Combine sugar and cumin; sprinkle 2 Tbsp. sugar mixture over fish. Place fish in skillet, sugar side down; sprinkle with remaining sugar mixture.', 'Cook 3 to 5 min. on each side or until fish flakes easily with fork. Remove from skillet; cover to keep warm.', 'Add lime and orange juices to skillet. Cook on medium heat until heated through, stirring occasionally. Remove from heat. Stir in cilantro and mint. Spoon evenly over fish.']",Caribbean Recipes,Island Citrus Fish,"['03/19/2019, 15:47:54']",True
regional,Get out some mangos and coconut milk to make our Mango-Coconut Chicken Recipe for stew! This savory coconut chicken recipe makes a great warm main dish.,Mango-Coconut Chicken Recipe.jpg,"['1 medium onion, thinly sliced', '1/2 cup KRAFT Zesty Italian Dressing', '4 cloves garlic, minced', '3 lb. assorted bone-in chicken pieces (breasts, thighs and drumsticks)', '1 can (13.5 oz.) coconut milk', '1-1/4 cups 2% milk', '4 oz. (1/2 of 8-oz. pkg.) PHILADELPHIA Cream Cheese, cubed', '1 medium green pepper, cut into thin strips', '1 medium red pepper, cut into thin strips', '2 medium mangos, cut into 1-inch chunks']","['Cook onions, dressing and garlic in large skillet on medium heat 3 min., stirring occasionally. Add chicken; cook 20 min. or until browned on both sides, turning occasionally. Reduce heat to low. Add coconut milk and 2% milk; stir. Cover; simmer 1 hour.', 'Remove chicken and onions from skillet; cover to keep warm. Skim off fat from liquid remaining in skillet. Add cream cheese to liquid in skillet; stir with wire whisk until well blended.', 'Add peppers and mangos; cover. Simmer 5 min. Return onions to skillet; stir. Top with the chicken.']",Caribbean Recipes,Mango-Coconut Chicken Recipe,"['03/11/2019, 18:35:32', '06/07/2018, 04:33:39', '07/17/2019, 15:09:10']",False
regional,"Discover this amazing recipe for Grilled Fish Tacos with Coleslaw for Two. These Grilled Fish Tacos with Coleslaw for Two are quick, cheesy and crunchy. This Healthy Living recipe is ready to enjoy in just 20 minutes.",Grilled Fish Tacos with Coleslaw for Two.jpg,"['2 Tbsp. lime juice, divided', '1 Tbsp. KRAFT Lite House Italian Dressing', '1/2 tsp. ground cumin', '1/2 lb. tilapia fillets', '4 flour tortillas (8 inch)', '2 Tbsp. KRAFT Light Mayo Reduced Fat Mayonnaise', '1 Tbsp. chopped fresh cilantro', '1-1/2 cups coleslaw blend (cabbage slaw mix)', '1/4 cup KRAFT 2% Milk Shredded Cheddar Cheese']","['Heat grill to medium heat.', 'Mix 1 Tbsp. lime juice, dressing and cumin. Grill fish 4 min. on each side or until fish flakes easily with fork, brushing occasionally with dressing mixture. Meanwhile, grill tortillas 1 min. or just until warmed, turning after 30 sec.; wrap in foil or towel to keep warm.', 'Combine remaining lime juice, mayo and cilantro in medium bowl. Add coleslaw blend; toss to coat. Use fork to break fish into bite-size pieces.', 'Top tortillas with coleslaw, fish and cheese; roll up.']",Caribbean Recipes,Grilled Fish Tacos with Coleslaw for Two,"['02/19/2019, 13:36:44', '05/21/2018, 03:18:47', '08/19/2018, 19:44:13']",False
regional,Try our SHAKE 'N BAKE Coconut Shrimp. This SHAKE 'N BAKE Coconut Shrimp is so sweet and crispy no one will believe it's a Healthy Living recipe!,SHAKE 'N BAKE Coconut Shrimp.jpg,"[""2/3 cup BAKER'S ANGEL FLAKE Coconut, toasted"", ""1 pkt. SHAKE 'N BAKE Chicken Coating Mix"", '1 tsp. curry powder', '1/4 tsp. ground red pepper (cayenne)', '1 egg', '2 Tbsp. water', '1 lb. uncooked extra-large shrimp, peeled with tails left on, deveined']","['Heat oven to 400°F.', 'Combine first 4 ingredients in pie plate; set aside. Whisk egg and water in separate pie plate until blended.', 'Dip shrimp, 1 at a time, in egg, then in coconut mixture, turning to completely coat both sides of each shrimp with egg before coating with coconut mixture; place on baking sheet sprayed with cooking spray. Press coating mixture firmly onto shrimp to secure.', 'Bake 10 to 12 min. or until shrimp are done.']",Caribbean Recipes,SHAKE 'N BAKE Coconut Shrimp,"['05/07/2019, 07:56:48']",False
regional,"Mixed nuts, cilantro, garlic and lime zest are blended with peanut oil and baked into a glorious crust in this Caribbean-style fish entrée.",Caribbean Nut-Crusted Fish.jpg,"['1/4 cup chopped PLANTERS Mixed Nuts', '2 Tbsp. chopped cilantro', '1 clove garlic, minced', '1 tsp. PLANTERS Peanut Oil', 'Zest and juice from 1 lime, divided', '4 tilapia fillets (1 lb.)', '1 pkg. (10 oz.) frozen broccoli florets', '2 cups hot cooked long-grain brown rice']","['Heat oven to 375°F.', 'Combine nuts, cilantro, garlic, oil and zest until well blended; set aside.', 'Place fish on lightly greased baking sheet; drizzle with lime juice. Top with nut mixture; press lightly into fish to secure.', 'Bake 10 to 12 min. or until fish flakes easily with fork. Meanwhile, cook broccoli as directed on package. Serve fish with the broccoli and rice.']",Caribbean Recipes,Caribbean Nut-Crusted Fish,"['01/31/2018, 20:56:14', '02/15/2019, 07:06:44', '06/02/2018, 10:20:38', '11/25/2018, 07:22:24']",True
